place.name,place.description,place.prices,place.ratings,place.mentions,place.location,place.region,place.spenttime,place.openingtime
The Plant Story,Paint & Pottery Studios • Lessons & Workshops,NA,5.0,"workshop,apothecary,gardening,miniature,nature,fun","Address11 Rhu Cross, Singapore, Singapore 437440 Singapore",Neighborhood: Tanjong Rhu,NA,10:00 AM - 7:00 PM
On Tap,Bars & Clubs,NA,5.0,,"Address335 Smith Street Chinatown Complex, Singapore 050335 Singapore",Neighborhood: Outram,< 1 hour,4:30 PM - 10:30 PM
NA,NA,NA,NA,,NA,NA,NA,NA
The Organic Room,Spas,NA,5.0,wax,"Address470 North Bridge Road #04-03 Bugis Cube Bugis Cube, Singapore 188735 Singapore",Neighborhood: Museum,1-2 hours,10:00 AM - 9:00 PM
La Source Spa,Spas,NA,4.0,stroke,"Address581 Orchard Road, The Shopping Gallery at The Hilton #02-17/18, Singapore 238883 Singapore",Neighborhood: Boulevard,1-2 hours,11:00 AM - 8:00 PM
The Attic Place,Speciality & Gift Shops,NA,5.0,purchase,"Address545 Orchard Road Far East Shopping Centre Far East Shopping centre #04-08, Singapore 238882 Singapore",Neighborhood: Boulevard,1-2 hours,11:30 AM - 6:30 PM
The Spa by The Ultimate,Spas,NA,5.0,facial,"Address9 Sentul Crescent #04-05 SAFRA Punggol, Singapore 828654 Singapore",Neighborhood: Punggol Town Centre,NA,NA
NA,NA,NA,NA,,NA,NA,NA,NA
NA,NA,NA,NA,,NA,NA,NA,NA
Tanah Merah Country Club,Golf Courses,NA,4.5,,"Address25 Changi Coast Road Tanah Merah Country Club, Singapore 499803 Singapore",Neighborhood: Changi,NA,NA
BKK Bespoke,Speciality & Gift Shops,NA,5.0,tailor,"Address883 North Bridge Road Southbank Southbank Condominium, Singapore 198785 Singapore",Neighborhood: Punggol Town Centre,< 1 hour,7:00 PM - 9:00 PM
NA,NA,NA,NA,,NA,NA,NA,NA
Ayuthaya Spa,Spas,NA,4.5,,"Address9 Scotts Road Pacific Plaza Pacific Plaza, Singapore 228210 Singapore",Neighborhood: Boulevard,1-2 hours,11:00 AM - 10:00 PM
Axe Factor - Axe Throwing,Game & Entertainment Centers,NA,4.5,,"Address200 Turf Club Road The Grandstand #01-32/34, Singapore 287994 Singapore",Neighborhood: Swiss Club,1-2 hours,12:00 PM - 10:00 PM
SBS Transit,Bus Services,NA,3.5,"driving skills,driver,card,boarded",NA,NA,< 1 hour,NA
The Spa-Lon,Spas,NA,5.0,,"Address180 Kitchener Road City Square Mall #03-01 City Square Mall, Singapore 208539 Singapore",Neighborhood: Lavender,1-2 hours,NA
NA,NA,NA,NA,,NA,NA,NA,NA
Chevy's Bar and Bistro,Bars & Clubs,NA,4.5,,"Address247 Beach Road #01-01, Singapore 189756 Singapore",Neighborhood: Rochor,NA,NA
NA,NA,NA,NA,,NA,NA,NA,NA
Face Plus by Yamano Singapore,Spas,NA,5.0,,"Address181 Orchard Road Orchard Central #04-02 Orchard Central, Singapore 238896 Singapore",Neighborhood: Somerset,1-2 hours,11:00 AM - 10:00 PM
Senses Spa Beauty,Spas,NA,4.5,,"Address2 Handy Road The Cathay #03-19 The Cathay, Singapore 229233 Singapore",Neighborhood: Central Area/City Area,2-3 hours,1:00 PM - 10:00 PM
Sam's Custom Tailors,Speciality & Gift Shops,NA,4.5,,"Address14 Scotts Road Far East Plaza Unit 02-55, Far East Plaza, Singapore 228213 Singapore",Neighborhood: Central Area/City Area,< 1 hour,9:00 AM - 9:00 PM
NA,NA,NA,NA,,NA,NA,NA,NA
The Jiao Luo Shop,Speciality & Gift Shops,NA,5.0,,"Address5 Banda Street Floor 01 Kreta Ayer Heights 98, Singapore 050005 Singapore",Neighborhood: Outram,< 1 hour,NA
NA,NA,NA,NA,,NA,NA,NA,NA
"The Ritz-Carlton Spa, Singapore",Spas,NA,4.5,,"Address7 Raffles Avenue Ritz Carlton Millenia Singapore, Singapore 039799 Singapore",Neighborhood: Marina Centre,2-3 hours,9:00 AM - 11:00 PM
NA,NA,NA,NA,,NA,NA,NA,NA
ToTT Cooking Studio Classes,Cooking Classes,NA,4.5,,"Address2 Tampines Central 5 Century Square #02-14 Century Square, Singapore 529509 Singapore",Neighborhood: Swiss Club,1-2 hours,11:00 AM - 9:00 PM
MrMaxiCab Services,Taxis & Shuttles,NA,5.0,,NA,NA,2-3 hours,NA
NA,NA,NA,NA,,NA,NA,NA,NA
Raffles Country Club,Golf Courses,NA,4.0,,"Address450 Jalan Ahmad Ibrahim Raffles Country Club, Singapore 639932 Singapore",Neighborhood: Tuas,NA,NA
Kenko Reflexology and Fish Spa,Spas,NA,4.0,,"Address30 Raffles Avenue #02-08 Singapore Flyer, Singapore 039803 Singapore",Neighborhood: Marina Centre,NA,NA
Happy Harry's Shop,Speciality & Gift Shops,NA,5.0,"silk,fabric,tailor","Address254 South Bridge Road 01-01, Singapore 058803 Singapore",Neighborhood: Outram,< 1 hour,10:00 AM - 5:00 PM
NA,NA,NA,NA,,NA,NA,NA,NA
Clip 'n Climb HomeTeamNS,Game & Entertainment Centers,NA,4.5,"climbers,activity","Address51 Tampines Ave 4 Our Tampines Hub, Singapore 529684 Singapore",Neighborhood: Tampines,1-2 hours,12:00 PM - 9:00 PM
NA,NA,NA,NA,,NA,NA,NA,NA
Buds By Shangri-La,Game & Entertainment Centers,NA,4.0,play,"Address22 Orange Grove Road Shangri-La Hotel Shangri-La Hotel, Singapore 258350 Singapore",Neighborhood: Tanglin,2-3 hours,9:00 AM - 6:30 PM
Bon Limo,Taxis & Shuttles,NA,5.0,,"Address60 Airport Boulevard Changi Airport Terminal 2, Singapore 819643 Singapore",Neighborhood: Changi,NA,NA
NA,NA,NA,NA,,NA,NA,NA,NA
Gardens Shop,Speciality & Gift Shops,NA,4.0,,"Address1 Cluny Road National Parks Board Singapore Botanic Gardens, Singapore 259569 Singapore",Neighborhood: Tanglin,< 1 hour,NA
Toko Aljunied,Speciality & Gift Shops,NA,4.5,,"Address91 Arab Street, Singapore 199787 Singapore",Neighborhood: Rochor,NA,NA
Xi Yuan Foot Spa,Spas,NA,4.5,,NA,Neighborhood: Rochor,1-2 hours,NA
Silken Treasure,Speciality & Gift Shops,NA,5.0,,"Address405 Havelock Road Furama RiverFront, Singapore 169633 Singapore",Neighborhood: Central Area/City Area,1-2 hours,10:00 AM - 8:00 PM
NA,NA,NA,NA,,NA,NA,NA,NA
The White Spa,Spas,NA,5.0,,"Address167 Selegie Road, Singapore 188321 Singapore",Neighborhood: Rochor,1-2 hours,NA
Expressions @ Thomson,Spas,NA,5.0,,"Address2 Sin Ming Road #01-06 Sin Ming Plaza, Singapore 575583 Singapore",Neighborhood: Bishan,1-2 hours,10:30 AM - 8:30 PM
NA,NA,NA,NA,,NA,NA,NA,NA
NA,NA,NA,NA,,NA,NA,NA,NA
Artify Studio,Paint & Pottery Studios • Art Galleries • Universities & Schools,NA,5.0,art jamming,"Address200 Jalan Sultan Textile Centre #08-05 & #12-07 Textile Centre, Singapore 199018 Singapore",Neighborhood: Crawford,2-3 hours,10:00 AM - 9:30 PM
Kiztopia,Game & Entertainment Centers,NA,4.5,"indoor playground,train ride,trampoline","Address6 Raffles Boulevard Marina Square Marina Square Level 1, #01-09, Singapore 039594 Singapore",Neighborhood: Marina Centre,NA,NA
Executive Golf Course,Golf Courses,NA,4.0,,"AddressUpper Seletar Reservoir Mandai Road Track 7, Singapore 779384 Singapore",Neighborhood: Yishun,NA,NA
NA,NA,NA,NA,,NA,NA,NA,NA
Soul Well,Spas,NA,5.0,,"Address739 Havelock Road, Singapore 169654 Singapore",Neighborhood: Bukit Merah,2-3 hours,11:00 AM - 10:30 PM
Katapult Trampoline Park,Sports Complexes • Game & Entertainment Centers,NA,4.0,,"Address81 Lorong Chencharu Orto, Singapore 769198 Singapore",Neighborhood: Yishun,1-2 hours,NA
Healing Touch Spa,Spas,NA,4.5,"deep tissue massage,novena,masseuse,orchard","Address70 Thomas Road, Singapore 307588 Singapore",Neighborhood: Moulmein,NA,11:00 AM - 10:30 PM
NA,NA,NA,NA,,NA,NA,NA,NA
NA,NA,NA,NA,,NA,NA,NA,NA
Sampan Rides at Marina Bay Sands,Game & Entertainment Centers,NA,3.5,mbs,"Address2 Bayfront Avenue Marina Bay Sands The Shoppes at Marina Bay Sands, Singapore 018972 Singapore",Neighborhood: Marina Bay,NA,NA
The Olde Cuban,Cigar Bars,NA,3.5,,"Address2 Trengganu Street, #02-01, Singapore 058456 Singapore",Neighborhood: Outram,NA,NA
Spa Club At Beach Road,Spas,NA,4.0,masseuse,"Address75 Beach Road Floor 01 Fu Yuen Building 00, Singapore 189689 Singapore",Neighborhood: Central Area/City Area,NA,NA
Anthony The Spice Maker,Speciality & Gift Shops,NA,4.5,,"AddressBlk 333 Kreta Ayer Road Kreta Ayer Heights #01-25, Singapore 080333 Singapore",Neighborhood: Outram,< 1 hour,10:00 AM - 6:00 PM
Pat-A-Cake with Aruna,Lessons & Workshops • Cooking Classes,NA,5.0,,"Address6 Eu Tong Sen Street The Central #B1-27E, Clarke Quay Central, Singapore 059817 Singapore",Neighborhood: Central Area/City Area,1-2 hours,NA
Diggersite,Game & Entertainment Centers,NA,4.5,,"Address81 Lorong Chencharu Orto, Singapore 769198 Singapore",Neighborhood: Marine Parade,1-2 hours,11:00 AM - 9:00 PM
NA,NA,NA,NA,,NA,NA,NA,NA
Emperor Spa,Spas,NA,4.0,massage service,"Address90 Eu Tong Sen Street Old CID Building, Singapore 059811 Singapore",Neighborhood: Central Area/City Area,1-2 hours,NA
NA,NA,NA,NA,,NA,NA,NA,NA
Peranakan Place,Bars & Clubs,NA,4.0,,NA,NA,NA,12:00 PM - 2:00 AM
Ayush Ayurvedic Pte Ltd,Spas,NA,4.0,,"Address146 Race Course Road, Singapore 218595 Singapore",Neighborhood: Little India,1-2 hours,9:00 AM - 9:00 PM
The Baking Loft,Cooking Classes,NA,5.0,,"Address12 Eu Tong Sen Street #05-169 the Central Soho2 at Central, Singapore 059819 Singapore",Neighborhood: Central Area/City Area,2-3 hours,NA
E-Waves Fishbyte Pte Ltd,Speciality & Gift Shops,NA,5.0,,"AddressClementi West Street 2 Block 713, #01-12, Singapore 120713 Singapore",Neighborhood: Clementi,More than 3 hours,NA
Kidz Amaze,Game & Entertainment Centers,NA,4.5,,"Address293 Lorong 6 Toa Payoh Safra Clubhouse (Toa Payoh) Safra Toa Payoh, Singapore 319387 Singapore",Neighborhood: Toa Payoh Central,NA,NA
TJI's Transporter,Taxis & Shuttles,NA,5.0,,NA,NA,< 1 hour,NA
Attica,Bars & Clubs,NA,3.5,,"Address3A River Valley Road #02-05 Clarke Quay Entrance is at ground level in the main fountain area of Clark Quay, Singapore 179019 Singapore",Neighborhood: Central Area/City Area,More than 3 hours,10:30 PM - 5:00 AM
Ashi Reflexology,Spas,NA,5.0,"holland village,air con,tcm,knead,skills","Address211 Holland Ave, #03-40/41 Holland Road Shopping Centre, Singapore 278967 Singapore",NA,1-2 hours,11:00 AM - 7:00 PM
Rule of Thumb Sanctuary Spa,Spas,NA,4.0,,"Address289 Beach Road, Suite 01-01, Singapore 199552 Singapore",Neighborhood: Rochor,NA,10:00 AM - 4:00 AM
KF1,Game & Entertainment Centers,NA,4.5,"track,fun","Address1 Turf Club Avenue Singapore Racecourse, Singapore 738078 Singapore",Neighborhood: Sungei Kadut,1-2 hours,1:00 PM - 9:00 PM
g.spa Fitness and Recreation Hub,Spas,NA,3.5,fountain,"Address102 Guillemard Road Floor 02 Singapore Badminton Association Building 02, Singapore 399719 Singapore",Neighborhood: Red Light District,More than 3 hours,NA
NA,NA,NA,NA,,NA,NA,NA,NA
Yang Xin Dian Foot Reflexology,Spas,NA,4.0,,"Address1 Park Road People's Park Complex Floor 03 Unit 25 12, Singapore 059108 Singapore",Neighborhood: Outram,NA,NA
Nimble/Knead,Spas,NA,4.5,,"Address66 Eng Watt Street Tiong Bahru Estate #01-28, Singapore 160066 Singapore",Neighborhood: Bukit Merah,NA,11:00 AM - 10:00 PM
The Sandalwood Room,Speciality & Gift Shops,NA,5.0,,"Address78 Tras Street Parking at Orchid Hotel, Singapore 079017 Singapore",Neighborhood: Rochor,1-2 hours,11:00 AM - 8:00 PM
Expressions @ Jewel,Spas,NA,4.0,slimming,"Address78 Airport Boulevard #04-238 Jewel Changi Airport, Singapore 819666 Singapore",Neighborhood: Changi,1-2 hours,10:00 AM - 10:00 PM
Singapore Cab Booking,Taxis & Shuttles,NA,4.0,"awesome experience,company,driver,ride",NA,Neighborhood: Marina Bay,< 1 hour,NA
Aegle TCM Clinique,Spas,NA,4.5,,"Address11 Unity Street Robertson Walk, Singapore 237995 Singapore",Neighborhood: Robertson Quay,2-3 hours,10:00 AM - 8:00 PM
Neue Fit,Health Clubs • Yoga & Pilates,NA,5.0,,"Address1 Stadium Place #02-07, Kallang Wave Mall, Singapore 397688 Singapore",Neighborhood: Tanjong Rhu,1-2 hours,10:00 AM - 10:00 PM
Ayur Centre Pte. Ltd,Spas,NA,5.0,,"Address84 Bedok North Street 4 #01-17, Singapore 460084 Singapore",Neighborhood: Bedok,1-2 hours,9:00 AM - 9:00 PM
Healing Touch Spa,Spas,NA,5.0,deep tissue massage,"Address354 Alexandra Road Alexis #01-18 Alexis Condo, Singapore 159948 Singapore",Neighborhood: Mei Chin,NA,11:00 AM - 10:30 PM
Square 2,Speciality & Gift Shops,NA,3.5,,"Address10 Sinaran Drive Square 2, Singapore 307506 Singapore",Neighborhood: Moulmein,NA,11:00 AM - 10:00 PM
NA,NA,NA,NA,,NA,NA,NA,NA
NA,NA,NA,NA,,NA,NA,NA,NA
Spa by JW,Spas,NA,5.0,,"Address30 Beach Road Jw Marriott Singapore South Beach JW Marriott Hotel Singapore South Beach, Singapore 189763 Singapore",Neighborhood: Central Area/City Area,NA,11:00 AM - 8:00 PM
NA,NA,NA,NA,,NA,NA,NA,NA
Pioneer Concept Store,Speciality & Gift Shops,NA,5.0,,"Address81 Ubi Avenue 4 Ub. One #01-09, UB. One, Singapore 408830 Singapore",Neighborhood: Kampong Ubi,< 1 hour,10:00 AM - 7:00 PM
My Happy Feet,Spas,NA,4.5,,"Address21A Lorong Mambong Holland Village Holland Village, Singapore 277680 Singapore",Neighborhood: Holland Village,NA,11:00 AM - 9:00 PM
Don Don: Donki,Speciality & Gift Shops • Department Stores,NA,4.5,"japanese products,shop","Address1 Maritime Square Harbourfront Centre, Singapore 099253 Singapore",Neighborhood: Bukit Merah,NA,NA
Premier's Tea Moods Pte Ltd,Speciality & Gift Shops,NA,5.0,,"Address44 Horne Road Network Courier Building network Courier Building, Singapore 209067 Singapore",Neighborhood: Lavender,< 1 hour,8:30 AM - 6:30 PM
NA,NA,NA,NA,,NA,NA,NA,NA
Fort Sanctuary,Speciality & Gift Shops,NA,5.0,,"Address8 Raffles Avenue Esplanade Mall #02-04 Esplanade Mall, Singapore 039802 Singapore",Neighborhood: Marina Centre,< 1 hour,1:00 PM - 9:00 PM
Pokemon Center Singapore,Speciality & Gift Shops,NA,4.0,,"Address78 Airport Boulevard #04-201 & 202, Jewel Changi Airport, Singapore 819666 Singapore",Neighborhood: Changi,NA,NA
Elephant Parade Haji Lane,Speciality & Gift Shops,NA,5.0,,"Address30 Haji Lane, Singapore 189223 Singapore",Neighborhood: Rochor,1-2 hours,NA
Nithya Priyan School of Yoga,Yoga & Pilates,NA,5.0,classes,"Address235A South Bridge Road Across the Road from Sri Mariamman Temple, Singapore 058784 Singapore",Neighborhood: Outram,1-2 hours,"7:30 AM - 1:15 PM, 6:30 PM - 9:00 PM"
Shen Nong Spa,Spas,NA,5.0,chinese sausage,"Address17 Carpenter St #02-01, Singapore 059906 Singapore",Neighborhood: Central Area/City Area,NA,NA
Cluny Court,Speciality & Gift Shops • Points of Interest & Landmarks,NA,4.0,,"Address501 Bukit Timah Road Cluny Court, Singapore 259760 Singapore",Neighborhood: Tanglin,< 1 hour,NA
Supermama Store,Speciality & Gift Shops,NA,4.0,,"Address93 Stamford Road National Museum of Singapore National Museum of Singapore, Singapore 178897 Singapore",Neighborhood: Rochor,< 1 hour,11:00 AM - 8:00 PM
Singapore Symphony Orchestra,Symphonies • Theatre & Performances,NA,4.5,,"Address11 Empress Place Victoria Memorial Hall #01-02, Victoria Concert Hall, Singapore 179558 Singapore",Neighborhood: City Hall,1-2 hours,9:00 AM - 6:30 PM
NA,NA,NA,NA,,NA,NA,NA,NA
Healing Touch,Spas,NA,4.0,,"Address5 Tank Rd Nagarathar Bldg #01-01/02, River Valley Branch, Singapore 238061 Singapore",Neighborhood: Central Area/City Area,NA,NA
The Secret Mermaid,Bars & Clubs,NA,4.0,,"Address10 Collyer Quay Ocean Financial Centre B1-08 Ocean Financial Centre, Singapore 049315 Singapore",Neighborhood: Central Area/City Area,NA,NA
Face And Body,Speciality & Gift Shops,NA,5.0,shop,"Address5001 Beach Road Golden Mile Complex unit 01-66H and 02-43, Singapore 199588 Singapore",Neighborhood: Crawford,< 1 hour,NA
Orto,Bodies of Water • Parks • Game & Entertainment Centers,NA,3.5,,"Address81 Lorong Chencharu Orto Orto, Singapore 769198 Singapore",Neighborhood: Yishun,2-3 hours,NA
Healthland Thai Massage,Spas,NA,4.0,,"Address252A South Bridge Road Chinatown, Singapore 058801 Singapore",Neighborhood: Outram,NA,NA
Nanyang Sauce,Paint & Pottery Studios • Cooking Classes,NA,5.0,,"Address288 East Coast Road, Singapore 428949 Singapore",Neighborhood: Joo Chiat,NA,NA
Littered With Books,Speciality & Gift Shops,NA,4.0,bookshop,"Address20 Duxton Road, Singapore 089486 Singapore",Neighborhood: Outram,NA,12:00 PM - 8:00 PM
NA,NA,NA,NA,,NA,NA,NA,NA
LilliPutt Indoor Mini Golf,Golf Courses,NA,3.5,,"Address902 East Coast ParkwayBlock B #03-05Playground @ Big Splash, Singapore 449874 Singapore",Neighborhood: Marine Parade,NA,10:00 AM - 8:00 PM
The Army Market,Speciality & Gift Shops,NA,4.0,,"Address505 Beach Road Golden Mile Food Centre Golden Mile Food Centre, 2nd Floor, Singapore 199583 Singapore",Neighborhood: Crawford,NA,11:00 AM - 8:30 PM
Que Pasa Wine Bar & Tapas,Bars & Clubs,NA,3.5,"orchard,shophouse","Address7 Emerald Hill Road, Singapore 229291 Singapore",Neighborhood: Emerald Hill,NA,NA
Celestial Sanctuary,Spas,NA,4.0,,"Address231 Orchard Road #03-00 Orchard Shopping Center, Singapore 238866 Singapore",Neighborhood: Somerset,1-2 hours,NA
Sanctuary Thai Spa,Spas,NA,5.0,masseuse,"Address6 Telok Blangah Crescent #01-432 Mount Faber Green, Singapore 090006 Singapore",Neighborhood: Bukit Merah,NA,10:30 AM - 10:30 PM
Design Museum Shop,Speciality & Gift Shops,NA,4.0,,"Address11 Marina Boulevard Red Dot Design Museum Red Dot Design Museum, Singapore 018940 Singapore",Neighborhood: Marina Bay,< 1 hour,11:00 AM - 2:00 AM
NA,NA,NA,NA,,NA,NA,NA,NA
Head & Hair Spa Lily ,Spas,NA,5.0,,"Address6A Shenton Way OUE Downtown Gallery 2, #03-16, Singapore 068816 Singapore",Neighborhood: Cecil,1-2 hours,10:00 AM - 8:00 PM
Syoujin,Spas,NA,5.0,,"Address1 Northpoint Drive Northpoint City, Singapore 768019 Singapore",Neighborhood: Tanglin,NA,NA
Lim's Arts and Living,Speciality & Gift Shops,NA,4.5,,"Address211 Holland Avenue # 02 Holland Road Shopping Centre 01, Singapore 278967 Singapore",Neighborhood: Holland Village,NA,NA
Pure Wellness Foot Spa,Spas,NA,5.0,,"AddressBlock 102 Yishun Avenue 5 #01-129 Chong Pang Town, Singapore 760102 Singapore",Neighborhood: Yishun,1-2 hours,11:00 AM - 10:30 PM
St Gregory Javana Spa,Spas,NA,5.0,,"Address7500A Beach Road Plaza Hotel Level 4 Plaza Hotel, Singapore 199593 Singapore",Neighborhood: Crawford,NA,NA
Cosmetics & Perfumes by Shilla,Speciality & Gift Shops,NA,4.0,,NA,Neighborhood: Changi,NA,NA
Sugar & Spice Soap Crafting Classes,Lessons & Workshops,NA,5.0,,"Address81 Ubi Avenue 4 Ub. One 4 #10-19 UB. One, Singapore 408830 Singapore",Neighborhood: Kampong Ubi,2-3 hours,NA
The Pump Room,Bars & Clubs,NA,3.5,,"Address3B River Valley Road The Foundry # 01 10 09, Singapore 179021 Singapore",Neighborhood: Central Area/City Area,NA,NA
Rumah Bebe,Speciality & Gift Shops,NA,3.5,,"Address113 East Coast Road, Singapore 428803 Singapore",Neighborhood: Marine Parade,NA,NA
NA,NA,NA,NA,,NA,NA,NA,NA
Green Apple Spa,Spas,NA,3.5,"foot massage,session,movie,hv,masseuse","Address765 North Bridge Road, Singapore 198733 Singapore",Neighborhood: Rochor,NA,12:00 PM - 4:00 AM
Fancy,Bars & Clubs,NA,5.0,,"Address35 Canal Road Suite 01-01, Singapore 59291 Singapore",Neighborhood: Central Area/City Area,NA,5:00 PM - 12:00 AM
Simply Toys,Speciality & Gift Shops,NA,4.5,,"Address68 Orchard Road Plaza Singapura Plaza Singapura, #07-10/11A, Singapore 238839 Singapore",Neighborhood: Museum,NA,NA
Campers Corner Outdoor Outfitters,Speciality & Gift Shops,NA,4.0,,"Address51 Waterloo Street #01-01/03, Singapore 229833 Singapore",Neighborhood: Rochor,NA,12:00 PM - 8:00 PM
Huggs-Epigram Coffee Bookshop,Speciality & Gift Shops,NA,4.0,,"Address45 Maxwell Road The Ura Centre #01-01 The URA Centre, Singapore 069118 Singapore",Neighborhood: Central Business District,1-2 hours,10:00 AM - 7:00 PM
BE: Leather Lab,Lessons & Workshops,NA,5.0,,"Address2 Sims Close #06-06 Gemini @ Sims Gemini @ Sims, Singapore 387298 Singapore",Neighborhood: Aljunied,2-3 hours,NA
House of Villeroy & Boch,Speciality & Gift Shops,NA,4.5,,"Address15 Stamford Road L1-74/76 Capitol Piazza, Singapore 178906 Singapore",Neighborhood: City Hall,1-2 hours,11:00 AM - 9:00 PM
NA,NA,NA,NA,,NA,NA,NA,NA
Maximum Drift Karting Arena,Game & Entertainment Centers,NA,4.5,,"Address81 Lorong Chencharu Orto Orto, #01-15, Yishun, Singapore 769198 Singapore",Neighborhood: Yishun,< 1 hour,NA
NA,NA,NA,NA,,NA,NA,NA,NA
So Chocolate,Speciality & Gift Shops,NA,4.0,,NA,Neighborhood: Changi,NA,NA
Harley-Davidson of Singapore,Gear Rentals,NA,5.0,,"Address253 Alexandra Road #01-04, Singapore 159936 Singapore",Neighborhood: Bukit Merah,1-2 hours,9:00 AM - 7:00 PM
Club 5,Bars & Clubs,NA,4.5,,"Address7500 Beach Road The Plaza, Singapore 199591 Singapore",Neighborhood: Crawford,1-2 hours,11:00 AM - 10:30 PM
One One Reflexology & Healthcare Center,Spas,NA,4.0,,"Address22A Smith Street Chinatown Food Steet, Singapore 058936 Singapore",Neighborhood: Outram,NA,NA
Trimmings Salon & Spa - AVEDA,Spas,NA,5.0,,"Address123 Tanglin Road Tudor Court (next to Tanglin Mall), Singapore 247920 Singapore",Neighborhood: Central Area/City Area,2-3 hours,9:00 AM - 9:00 PM
NA,NA,NA,NA,,NA,NA,NA,NA
Grassroots Book Room,Speciality & Gift Shops,NA,4.0,,"Address25 Bukit Pasoh Road, Singapore 089839 Singapore",Neighborhood: Central Area/City Area,1-2 hours,NA
HammerHouse SG,Other Fun & Games • Game & Entertainment Centers,NA,5.0,,"Address24B Temple Street, Level 3 unit 2-3min walk from Chinatown MRT exit A, Singapore 058569 Singapore",Neighborhood: Outram,1-2 hours,12:00 PM - 10:00 PM
Adrift Anapauo Massage & Spa,Spas,NA,4.0,,"Address3 Gateway Drive Westgate #02-40c, Singapore 608532 Singapore",Neighborhood: Jurong East,1-2 hours,NA
NA,NA,NA,NA,,NA,NA,NA,NA
Precious Foot Reflexology (Toa Payoh),Spas,NA,5.0,,"Address177 Toa Payoh Central #01-134, Singapore 310177 Singapore",Neighborhood: Ang Mo Kio,1-2 hours,10:00 AM - 10:00 PM
Karaoke Manekineko - Marina Square,Karaoke Bars,NA,4.0,,"Address6 Raffles Boulevard Marina Square #03-208/209 Marina Square, Singapore 039594 Singapore",Neighborhood: Marina Centre,2-3 hours,NA
Clique Gaming,Game & Entertainment Centers,NA,5.0,,"Address35 Selegie Road Parklane Shopping Mall, Singapore 188307 Singapore",Neighborhood: Rochor,2-3 hours,NA
Roxy Records & Trading,Speciality & Gift Shops,NA,5.0,,"Address5 Coleman Street, Excelsior Shopping Centre Level 2, Unit 15, Singapore 179805 Singapore",Neighborhood: City Hall,NA,12:00 PM - 9:00 PM
Singapore Maxi Cab & Minibus Booking by SGMaxi Pte Ltd,Bus Services • Taxis & Shuttles,NA,4.0,,"Address80 Changi Road Centropod @ Changi 02-74, Singapore 419715 Singapore",Neighborhood: Geylang East,< 1 hour,9:00 AM - 10:00 PM
NA,NA,NA,NA,,NA,NA,NA,NA
NTUC Fairprice Hub,Speciality & Gift Shops,NA,4.5,,"Address1 Joo Koon Circle #03-22 Fairprice Hub, Singapore 629117 Singapore",Neighborhood: Joo Koon,NA,NA
Chocosan foot reflexology,Spas,NA,5.0,,"Address14 Scotts Road Far East Plaza, Singapore 228213 Singapore",Neighborhood: Central Area/City Area,NA,NA
The Pink Room International Nail Academy,Lessons & Workshops,NA,5.0,,"Address10 Anson Road International Plaza #36-12, International Plaza, Opposite Tanjong Pagar MRT, Singapore 079903 Singapore",Neighborhood: Central Business District,1-2 hours,11:30 AM - 9:30 PM
An Qi Spa,Spas,NA,5.0,,"Address135 Middle Road Bylands Building #01-10 Bylands Building, Singapore 188975 Singapore",Neighborhood: Rochor,NA,12:00 AM - 12:00 AM
Singapore XD Theatre,Game & Entertainment Centers,NA,4.0,,"Address8 Temasek Boulevard Suntec Tower Three Unit 02-09 Flyer Building, Singapore 038988 Singapore",Neighborhood: Central Area/City Area,NA,NA
Orchid Bowl,Bowling Alleys,NA,4.5,,"AddressNo. 1 Pasir Ris Close E!Hub@Downtown East #01-111 E!hub Downtown East, Singapore 519599 Singapore",Neighborhood: Pasir Ris,NA,NA
Meiko Tailor,Speciality & Gift Shops,NA,5.0,,"Address7 Raffles Boulevard Pan Pacific Hotel #02-01, Singapore 039595 Singapore",Neighborhood: Marina Centre,1-2 hours,10:00 AM - 8:00 PM
Charles & Keith,Speciality & Gift Shops,NA,3.5,,NA,Neighborhood: Changi,NA,NA
Mei Yaa Foot Massage,Spas,NA,5.0,,"Address50 East Coast Road Roxy Square, Singapore 428769 Singapore",Neighborhood: Marine Parade,NA,NA
M Studio by Mayer,Cooking Classes,NA,5.0,,"Address12 Kallang Avenue Aperia #02-02/03, Singapore 339511 Singapore",Neighborhood: Kallang,NA,NA
Healthfit Massage Therapy,Spas,NA,4.5,,"Address190 Middle Road #02-24 Fortune Centre Fortune Centre, Singapore 188979 Singapore",Neighborhood: Rochor,NA,11:00 AM - 8:30 PM
Singapore Souvenir Centre,Speciality & Gift Shops,NA,4.0,,"Address52 Queen Street Bugis Village, Singapore 188539 Abfl/c, Singapore 188539 Singapore",Neighborhood: Rochor,1-2 hours,9:00 AM - 10:00 PM
Marina Bay Sands Skating Rink,Game & Entertainment Centers,NA,3.5,,"Address10 Bayfront Avenue Marina Bay Sands Marina Bay Sands, The Shoppes, Canal Level, B2, Singapore 018956 Singapore",Neighborhood: Marina Bay,NA,NA
NA,NA,NA,NA,,NA,NA,NA,NA
SK-II Boutique Spa,Spas,NA,4.0,,"Address31 Scotts Road, Singapore 228225 Singapore",Neighborhood: Central Area/City Area,NA,10:00 AM - 9:00 PM
Living Legends,Game & Entertainment Centers,NA,5.0,,"Address1 Sophia Road Peace Centre Peace Centre No 02-07, Singapore 228149 Singapore",Neighborhood: Rochor,1-2 hours,NA
2Be Yoga,Yoga & Pilates,NA,5.0,,"Address127B Telok Ayer Street #02-01, Singapore 068596 Singapore",NA,1-2 hours,6:45 AM - 9:30 PM
NA,NA,NA,NA,,NA,NA,NA,NA
Spin Paint House,Paint & Pottery Studios,NA,5.0,art jamming,"Address61 Kaki Bukit Place Eunos Techpark Printaid Building #04-00, Singapore 416233 Singapore",Neighborhood: Bedok,NA,3:00 PM - 9:00 PM
NA,NA,NA,NA,,NA,NA,NA,NA
NA,NA,NA,NA,,NA,NA,NA,NA
Singapore Soap: Soap Crafting Classes,Lessons & Workshops,NA,5.0,soap making,"Address80 Genting Lane #03-07 Ruby Industrial Complex Ruby Industrial Complex, Genting Block, Singapore 349565 Singapore",Neighborhood: Geylang,2-3 hours,10:00 AM - 4:30 PM
My Foot Reflexology,Spas,NA,4.5,,NA,Neighborhood: Changi,NA,NA
The Time of Tea,Speciality & Gift Shops,NA,4.5,,"Address53 Chin Swee Road - 03-11 #03-11, Singapore 160053 Singapore",Neighborhood: Central Area/City Area,NA,NA
Keepers: Singapore Designer Collective,Speciality & Gift Shops,NA,4.5,,"Address230 Orchard Road Faber House, Singapore 238854 Singapore",Neighborhood: Emerald Hill,< 1 hour,NA
NA,NA,NA,NA,,NA,NA,NA,NA
NA,NA,NA,NA,,NA,NA,NA,NA
The Fragment Room,Game & Entertainment Centers,NA,4.5,play,"Address3 Balestier Road Singapore Malay Football Club, Singapore 329671 Singapore",Neighborhood: Lavender,< 1 hour,1:00 PM - 10:00 PM
Hao Yi Tou,Spas,NA,5.0,foot reflexology,"Address101 Upper Cross Street #1-11 People's Park Centre People's Park Centre, Singapore 058357 Singapore",NA,NA,10:00 AM - 9:00 PM
