place.name,place.description,place.prices,place.ratings,place.mentions,place.location,place.region,place.spenttime,place.openingtime
Oh Chin Huat Hydroponic Farms,Farms,NA,3.5,,"Address14A Bah Soon Pah Road, Singapore 769970 Singapore",Neighborhood: Yishun,NA,NA
The Bible House,Points of Interest & Landmarks • Religious Sites,NA,4.0,,"Address7 Armenian Street Bible House, Singapore 179932 Singapore",Neighborhood: Museum,1-2 hours,10:00 AM - 7:00 PM
DBS Asia Treasures Lounge,Airport Lounges,NA,4.5,,NA,Neighborhood: Changi,NA,NA
Kampong Kapor Methodist Church,Churches & Cathedrals,NA,3.5,,"Address1 Kampong Kapor Road Kampong Kapor Methodist Church, Singapore 208673 Singapore",Neighborhood: Rochor,< 1 hour,NA
Amusement World,Ferries,NA,3.0,,"Address50 Tanah Merah Ferry Road Tanah Merah Ferry Terminal Tanah Merah Ferry Terminal, Singapore 498833 Singapore",Neighborhood: Changi,NA,12:00 AM - 11:59 PM
Alsagoff Arab School,Historic Sites • Architectural Buildings • Educational sites,NA,3.5,,"Address111 Jalan Sultan Madrasah Alsagoff Al-Arabiah, Singapore 199006 Singapore",Neighborhood: Rochor,NA,NA
Old Bukit Timah Railway Station,Historic Sites • Points of Interest & Landmarks,NA,3.0,,NA,NA,< 1 hour,NA
Library@Harbourfront,Libraries,NA,5.0,"study,libraries,volunteers,topic,sentosa,visitors","Address1 Harbourfront Walk Vivo City, Singapore 098585 Singapore",Neighborhood: Bukit Merah,2-3 hours,11:00 AM - 9:00 PM
Foundation Stone of the Monument of the Early Founders of Singapore,Points of Interest & Landmarks • Monuments & Statues,NA,3.0,,"Address1 Fullerton Square Fullerton Hotel The Pedestrian walkway opposite Fullerton Building, Singapore 049178 Singapore",Neighborhood: Central Area/City Area,< 1 hour,NA
The Cocoa Trees,Airport Shops,NA,2.0,,NA,Neighborhood: Changi,NA,NA
Singapore Polo Club,Sports Complexes,NA,3.5,,"Address80 Mount Pleasant Road Singapore Polo Club, Singapore 298334 Singapore",Neighborhood: Mount Pleasant,1-2 hours,8:30 AM - 10:00 PM
Goshen Art Gallery,Art Galleries,NA,5.0,,"Address13 Stamford Road Capitol Piazza #b2-46/47, Singapore 178905 Singapore",Neighborhood: City Hall,< 1 hour,11:00 AM - 8:00 PM
Tan Kim Seng Fountain,Points of Interest & Landmarks • Monuments & Statues • Fountains,NA,3.0,"reservoir,waterworks,figures,erected,fullerton",NA,Neighborhood: Marina Bay,< 1 hour,NA
Masjid Kampong Delta,Religious Sites,NA,4.0,,"Address10 Delta Avenue Masjid Kampong Delta, Singapore 169831 Singapore",Neighborhood: Bukit Merah,NA,NA
Sultan's Gate,Historic Sites • Points of Interest & Landmarks,NA,2.5,,NA,Neighborhood: Rochor,1-2 hours,NA
Fidgets,Playgrounds,NA,3.5,,"Address200 Turf Club Road The Grandstand 04-05 Turf City, Singapore 287994 Singapore",Neighborhood: Swiss Club,NA,NA
Masjid Falah,Religious Sites,NA,4.5,"masha allah,beautiful mosque,pray","Address15 Cairnhill Road #01-01, Singapore 229650 Singapore",Neighborhood: Somerset,NA,NA
Pagode de 7 étages,Points of Interest & Landmarks • Architectural Buildings • Lookouts,NA,4.0,,"Address1 Chinese Garden Road Chinese Garden, Singapore 619795 Singapore",Neighborhood: Jurong East,< 1 hour,NA
Rain Oculus,Points of Interest & Landmarks,NA,4.0,,"Address10 Bayfront Avenue Marina Bay Sands Marina Bay Sands Singapore, Singapore 018956 Singapore",Neighborhood: Marina Bay,< 1 hour,10:00 AM - 11:00 PM
Squeeze,Sports Camps & Clinics,NA,5.0,,"Address171 Thomson Road Goldhill Shopping Centre, Singapore 307622 Singapore",Neighborhood: Moulmein,NA,NA
Masjid Yusof Ishak,Architectural Buildings • Religious Sites,NA,4.0,,"Address10 Woodlands Drive 17 Masjid Yusof Ishak Woodlands, Singapore 737740 Singapore",Neighborhood: Woodlands South,NA,NA
Sembawang Shopping Centre,Shopping Malls,NA,3.5,,"Address604 Sembawang Road Sembawang Shopping Centre, Singapore 758459 Singapore",Neighborhood: Sembawang,NA,10:30 AM - 10:00 PM
Lim Bo Seng Memorial,Monuments & Statues,NA,3.5,,"Address1 Esplanade Drive Esplanade - Theatres On the Bay, Singapore 038981 Singapore",Neighborhood: Marina Centre,NA,NA
Antiques of the Orient,Antique Shops,NA,5.0,,"Address19 Tanglin Road # 02 Tanglin Shopping Centre 40, Singapore 247909 Singapore",Neighborhood: Central Area/City Area,NA,10:00 AM - 5:30 PM
Degiosart,Art Galleries,NA,5.0,"tiong bahru,gallery,asian","AddressTiong Bahru, Blk 57 01-82 Eng Hoon Street, Singapore 160057 Singapore",Neighborhood: Bukit Merah,NA,10:00 AM - 7:00 PM
Singapore Coins And Notes Museum,Speciality Museums,NA,3.0,,"Address40 Pagoda Street, Singapore 059199 Singapore",Neighborhood: Outram,1-2 hours,10:00 AM - 8:00 PM
Pandan Reservoir,Nature & Wildlife Areas,NA,3.5,"pandan,jurong,trees",NA,NA,2-3 hours,NA
Amazing Castle,Playgrounds,NA,5.0,,"Address8 Grange Road Cathay Cineleisure  Orchard, Singapore 239695 Singapore",Neighborhood: Somerset,< 1 hour,Closed until further notice
Bukit Chermin Boardwalk,Piers & Boardwalks,NA,3.5,"keppel island,mrt station,mangroves,walkway",NA,Neighborhood: Bukit Merah,NA,NA
Tampines Eco Green,Parks,NA,4.0,"greenery,forest","Address9 Tampines Avenue Tampines Avenue 12, Singapore 529787 Singapore",Neighborhood: Tampines North,1-2 hours,7:00 AM - 7:00 PM
Former Keng Teck Whay Building,Historic Walking Areas • Architectural Buildings • Religious Sites,NA,3.5,,"Address150 Telok Ayer Street, Singapore 068608 Singapore",Neighborhood: Central Area/City Area,NA,NA
KF1 Arena Karting Circuit,Auto Racing Tracks,NA,5.0,,"Address511 Upper Jurong Road Arena Country Club, Singapore 638366 Singapore",Neighborhood: Jurong West,1-2 hours,NA
UOB Art Gallery,Art Galleries,NA,5.0,,"Address80 Raffles Place, UOB Plaza 1, Ground Floor, Singapore 048624 Singapore",Neighborhood: Raffles Place,< 1 hour,9:00 AM - 6:30 PM
Steel in Bloom,Gardens,NA,4.0,,"AddressTerminal 4 Departure Transit Hall, Singapore 918146 Singapore",Neighborhood: Changi,1-2 hours,NA
Katong Swimming Complex,Sports Complexes,NA,5.0,,"Address111 Wilkinson Road Katong Swimming Complex, Singapore 436752 Singapore",Neighborhood: Marine Parade,NA,NA
Church of True Light,Religious Sites,NA,3.0,,"Address25G Perak Road, Singapore 208142 Singapore",Neighborhood: Rochor,NA,NA
Old Malay and Muslim Cemeteries,Cemeteries,NA,3.5,,NA,Neighborhood: Bukit Panjang,NA,NA
Former Thong Chai Medical Institution,Historic Sites • Architectural Buildings,NA,3.5,,"Address50 Eu Tong Sen Street Thong Chai Medical Institution, Singapore 059803 Singapore",Neighborhood: Central Area/City Area,NA,NA
Pasir Panjang,Neighborhoods,NA,3.5,,NA,Neighborhood: Pasir Panjang 1,NA,NA
Sri Krishna Mandir,Religious Sites,NA,4.0,,"Address9 Lor 29 Geylang, Singapore 388065 Singapore",Neighborhood: Aljunied,< 1 hour,NA
Tampines Changkat Butterfly Garden,Nature & Wildlife Areas • Gardens,NA,3.5,,"Address124 Tampines Street 11 Tampines Court 11, Singapore 521124 Singapore",Neighborhood: Tampines East,NA,NA
Hai Bin Prawning,Bodies of Water,NA,4.0,,"Address6 Tebing Lane #01-04, Singapore 828835 Singapore",Neighborhood: Punggol,NA,NA
Knightsbridge,Shopping Malls,NA,3.5,,"Address270 Orchard Road Grand Park Orchard, Singapore 238857 Singapore",Neighborhood: Somerset,NA,NA
Sri Manmatha Karuneshvarar Temple,Religious Sites,NA,3.5,,"Address226 Kallang Road Contact Number Is Not Contactable, Singapore 339096 Singapore",Neighborhood: Kampong Bugis,NA,NA
Oriental Elixir,Breweries,NA,4.0,"hidden bar,haji lane","Address10A Haji Lane Second Floor, Singapore 189203 Singapore",Neighborhood: Rochor,1-2 hours,NA
Pang Sua Pond,Bodies of Water,NA,3.0,,NA,Neighborhood: Bukit Panjang,< 1 hour,NA
Tan Swie Hian Museum,Art Museums,NA,5.0,,"Address460 Sims Avenue, Singapore 387601 Singapore",Neighborhood: Aljunied,NA,NA
Longchamp,Airport Shops,NA,3.5,,NA,Neighborhood: Changi,NA,NA
321 Clementi,Shopping Malls,NA,3.0,,"Address321 Clementi Avenue 3 321 Clementi, Singapore 129905 Singapore",Neighborhood: Clementi,1-2 hours,NA
Singapore Trading Post,Antique Shops,NA,5.0,,"Address315 Outram Road # 07 Tan Boon Liat Building 01 In the fashionable Tiong Bahru neighbourhood, Singapore 169074 Singapore",Neighborhood: Bukit Merah,NA,10:30 AM - 5:30 PM
Art Plural Gallery,Art Galleries,NA,5.0,,"Address38 Armenian Street, Singapore 179942 Singapore",Neighborhood: Museum,NA,NA
Hougang Swimming Complex,Sports Complexes,NA,4.0,,"Address95 Hougang Avenue 4 Hougang Swimming Complex, Singapore 538830 Singapore",Neighborhood: Trafalgar,NA,NA
Sree Maha Mariamman Temple,Points of Interest & Landmarks,NA,4.0,,"Address251 Yishun Avenue 3, Singapore 769061 Singapore",Neighborhood: Yishun,< 1 hour,NA
Heritage Marker SB31 - Squatters & Squalor,Historic Sites • Points of Interest & Landmarks,NA,4.5,,NA,Neighborhood: Outram,< 1 hour,12:00 AM - 10:59 PM
Coleman Bridge,Points of Interest & Landmarks • Bridges • Scenic Walking Areas,NA,3.0,,NA,Neighborhood: City Hall,< 1 hour,12:00 AM - 11:59 PM
Kebun Baru Birdsinging Club,Nature & Wildlife Areas,NA,4.5,,NA,NA,1-2 hours,NA
College of Medicine Building,Architectural Buildings • Educational sites,NA,3.0,,"Address16 College Road College of Medicine Building, Singapore 169854 Singapore",Neighborhood: Singapore General Hospital,NA,NA
The Singapore Buddhist Lodge,Points of Interest & Landmarks • Religious Sites • Monuments & Statues,NA,3.5,,"Address17 Kim Yam Road Buddhist Lodge Association, Singapore 239329 Singapore",Neighborhood: Central Area/City Area,NA,NA
Victoria Lily Pond,Bodies of Water,NA,4.0,,NA,Neighborhood: Central Area/City Area,< 1 hour,NA
Tua Peh Kong Temple,Religious Sites,NA,3.5,,NA,Neighborhood: Jurong West,NA,NA
The Canyon,Gardens,NA,4.0,,"Address18 Marina Gardens Drive Gardens By the Bay Gardens by the Bay, Singapore 018953 Singapore",Neighborhood: Central Area/City Area,NA,NA
Water Lily Garden,Gardens,NA,4.0,,"AddressTerminal 1 Departure Hall, Level 2, Transit Hall, Singapore 918146 Singapore",Neighborhood: Changi,1-2 hours,NA
Ban Siew San Temple,Points of Interest & Landmarks • Religious Sites,NA,4.0,,"Address2 Telok Blangah Drive, Singapore 109256 Singapore",Neighborhood: Telok Blangah Drive,1-2 hours,NA
Masjid Hussain Sulaiman,Religious Sites,NA,4.0,,"Address394 Pasir Panjang Road, Singapore 118730 Singapore",Neighborhood: Pasir Panjang 1,NA,NA
Singapore Expo,Convention Centers,NA,3.5,,"Address1 Expo Drive Singapore Expo, Singapore 486150 Singapore",Neighborhood: Changi,NA,NA
Kim Seng Park,Parks,NA,3.5,,NA,Neighborhood: Central Area/City Area,NA,NA
Rainforest by Sats,Airport Lounges,NA,3.0,,NA,Neighborhood: Changi,NA,NA
Bukit Batok WWII Memorial Site,Historic Sites,NA,3.5,war dead,"AddressLor Sesuai, Singapore 596305 Singapore",Neighborhood: Bukit Batok,NA,NA
Action City,Shopping Malls,NA,3.5,,"Address391B Orchard Road Ngee Ann City Tower B #B2-13 Ngee Ann City, Singapore 238874 Singapore",Neighborhood: Boulevard,< 1 hour,NA
Fort Canning Sculpture Trail,Points of Interest & Landmarks • Historic Walking Areas • Monuments & Statues,NA,3.5,,"AddressFort Canning Park, Singapore 179872 Singapore",Neighborhood: Museum,< 1 hour,NA
Ying Fo Fui Kun,Points of Interest & Landmarks • Historic Walking Areas • Architectural Buildings,NA,3.0,,"Address98 Telok Ayer Street, Singapore 048474, Singapore 048474 Singapore",Neighborhood: Outram,< 1 hour,NA
Singapore Pinacothèque de Paris,Art Museums,NA,3.0,,"Address5 Cox Terrace Fort Canning Arts Centre Fort Canning Arts Centre, Singapore 179620 Singapore",Neighborhood: Museum,1-2 hours,10:00 AM - 6:00 PM
Coach,Airport Shops,NA,2.5,,NA,Neighborhood: Changi,NA,NA
Serene Centre,Shopping Malls,NA,3.0,,"Address10 Jalan Serene Serene Centre Corner between Bukit Timah Road and Farrer Road, Singapore 258748 Singapore",Neighborhood: Tanglin,< 1 hour,NA
Telok Ayer Chinese Methodist Church,Architectural Buildings • Religious Sites • Churches & Cathedrals,NA,3.5,,"Address235 Telok Ayer Street, Singapore 068656, Singapore 068656 Singapore",Neighborhood: Cecil,< 1 hour,NA
Fish@Big Splash,Amusement & Theme Parks,NA,3.0,,"Address902 East Coast Parkway Aquatic Complex (Big Splash) #01-30, Block H, Big Splash, Singapore 449874 Singapore",Neighborhood: Marine Parade,NA,NA
Heritage Zone,Points of Interest & Landmarks,NA,4.5,,NA,NA,NA,NA
Kok Fah Technology Farm,Farms,NA,3.5,,"Address18 Sungei Tengah Road, Singapore 698974 Singapore",Neighborhood: Western Water Catchment,1-2 hours,9:00 AM - 5:00 PM
James Koh Silk Painting,Art Galleries,NA,4.5,,"Address41 Pagoda Street, Singapore 059200 Singapore",Neighborhood: Outram,< 1 hour,11:00 AM - 6:00 PM
Sun Pavilion,Gardens,NA,4.0,,"Address18 Marina Gardens Drive Gardens By the Bay, Singapore 018953 Singapore",Neighborhood: Central Area/City Area,NA,NA
Raffles Garden,Parks,NA,5.0,,NA,NA,< 1 hour,NA
Mahatma Gandhi Memorial,Historic Sites,NA,3.5,,"Address3 Race Course Road, Singapore 218731 Singapore",Neighborhood: Little India,< 1 hour,9:00 AM - 5:00 PM
MOVE Academy Singapore,Sports Camps & Clinics,NA,5.0,,"Address43 Carpenter Street Greatwood Building 02-01, Singapore 059922 Singapore",Neighborhood: Central Area/City Area,1-2 hours,7:30 PM - 9:30 PM
Tiong Bahru Air Raid Shelter,Historic Sites • Military Bases & Facilities,NA,3.0,,"Address78 Guan Chuan Street Tiong Bahru Estate, Singapore 160078 Singapore",Neighborhood: Bukit Merah,< 1 hour,NA
Jalan Besar Plaza,Shopping Malls,NA,2.5,,"Address101 Kitchener Road Jalan Besar Plaza, Singapore 208511 Singapore",Neighborhood: Lavender,NA,NA
Samarpan Meditation,Religious Sites,NA,5.0,,"Address246 Macpherson Road Betime Building #02-04 Betime Building, Singapore 348578 Singapore",Neighborhood: Geylang,< 1 hour,NA
Muscat Street,Points of Interest & Landmarks • Scenic Walking Areas,NA,3.0,,"Address3 Muscat Street Masjid Sultan, Singapore 198833 Singapore",Neighborhood: Rochor,< 1 hour,NA
Sang Nila Utama Garden,Gardens,NA,5.0,"fort canning park,indonesia,japanese,plants","Address1 Canning Rise National Archives of Singapore Fort Canning Park, Singapore 179868 Singapore",Neighborhood: Museum,< 1 hour,NA
Stranger Soccer,Sports Camps & Clinics • Sports Complexes • Arenas & Stadiums,NA,5.0,,"Address420 North Bridge Road North Bridge Centre #06-30, Singapore 188727 Singapore",Neighborhood: Bishan,1-2 hours,12:00 AM - 11:59 PM
Chettiar Temple,Religious Sites,NA,4.5,,"Address1 Tank Road Chettiar Temple, Singapore 238058 Singapore",Neighborhood: Central Area/City Area,NA,NA
Ang Chee Sia Ong Temple,Religious Sites,NA,3.5,,"Address131 West Coast Drive, Singapore 128014 Singapore",Neighborhood: Clementi,< 1 hour,NA
Woodlands Temporary Bus Interchange,Public Transportation Systems,NA,3.5,,NA,NA,NA,NA
Kang Ha Pheng Sim Kok,Architectural Buildings,NA,4.0,,"Address1 Lorong Bachok Geylang Shop Houses, Singapore 387780 Singapore",Neighborhood: Aljunied,< 1 hour,NA
Takashimaya Department Store,Department Stores,NA,4.0,,"Address391A, Singapore 238873 Singapore",Neighborhood: Boulevard,NA,NA
Nirvana Memorial Garden,Points of Interest & Landmarks,NA,5.0,"columbarium,arches,majestic","Address950 Old Choa Chu Kang Road Choa Chu Kang Columbarium, Singapore 699816 Singapore",Neighborhood: Western Water Catchment,1-2 hours,8:30 AM - 5:30 PM
Khadijah Mosque,Religious Sites,NA,3.5,,"Address583 Geylang Road Masjid Khadijah Aftter Lorong-30 & Before Lorong-29 Geylang, Singapore 389522 Singapore",Neighborhood: Aljunied,< 1 hour,NA
Burberry,Airport Shops,NA,3.5,,NA,Neighborhood: Changi,NA,NA
Hackson and Sons Shoe Polish and Artefacts Museum,Speciality Museums,NA,5.0,,"Address31 Woodlands Close Woodlands Horizon, Singapore 737855 Singapore",Neighborhood: Woodlands,< 1 hour,9:00 AM - 5:00 PM
Al-Amin Mosque,Points of Interest & Landmarks,NA,4.0,,"Address50 Telok Blangah Road Bay Hotel Singapore 098801, Singapore 098828 Singapore",Neighborhood: Bukit Merah,NA,NA
Michael Kors,Airport Shops,NA,1.5,,NA,Neighborhood: Changi,NA,NA
Darussalam Mosque,Churches & Cathedrals,NA,3.5,,"Address3002 Commonwealth Avenue West Masjid Darussalam, Singapore 129579 Singapore",Neighborhood: Clementi,NA,NA
Adidas Originals,Airport Shops,NA,4.5,,NA,Neighborhood: Changi,NA,NA
Vista Point,Shopping Malls,NA,4.0,,"Address548 Woodlands Drive 44 Vista Point, Singapore 730548 Singapore",Neighborhood: Woodlands South,NA,NA
Northpoint City,Shopping Malls,NA,3.5,,"Address930 Yishun Avenue 2 Singapore 769098, Singapore 769098 Singapore",Neighborhood: Yishun,NA,10:30 AM - 10:30 PM
Duxton Plain Park,Parks,NA,3.5,"tanjong pagar,heritage trees,hoxton","AddressNew Bridge Road, Singapore 089140 Singapore",Neighborhood: Outram,< 1 hour,NA
Kancanarama Buddhist Temple,Points of Interest & Landmarks,NA,4.5,,"Address2 Lorong Ong Lye Kancanarama Buddhist Temple, Singapore 536358 Singapore",Neighborhood: Serangoon,1-2 hours,NA
The Art Connector,Points of Interest & Landmarks • Monuments & Statues • Scenic Walking Areas,NA,3.5,,"Address23C Coleman Street, Singapore 179808 Singapore",Neighborhood: Museum,< 1 hour,NA
Prinsep Street Presbyterian Church,Churches & Cathedrals,NA,3.0,,"Address77 Prinsep Street Prinsep St Presbyterian Church, Singapore 188649 Singapore",Neighborhood: Rochor,< 1 hour,9:00 AM - 5:00 AM
Discover Singapore,Airport Shops,NA,5.0,,NA,Neighborhood: Changi,NA,NA
Ramakrishna Mission temple,Religious Sites,NA,4.0,,"Address179 Bartley Road Ramakrishna Mission Boys' Home Near Bartley MRT, Singapore 539784 Singapore",Neighborhood: Serangoon,1-2 hours,"6:00 AM - 12:30 PM, 4:00 PM - 8:30 PM"
HADO Singapore,Sports Camps & Clinics,NA,5.0,,"Address10 Ubi Crescent Ubi Techpark Ubi Techpark, Singapore 408564 Singapore",Neighborhood: Somerset,< 1 hour,NA
DFS Wines & Spirits,Airport Shops,NA,3.5,,NA,Neighborhood: Changi,NA,NA
Former Combined Operations Room Exhibition,Historic Sites,NA,5.0,,"Address195 Pearl's Hill Terrace, Singapore 168976 Singapore",Neighborhood: Central Area/City Area,< 1 hour,10:00 AM - 5:00 PM
Masjid Hajjah Rahimabi Kebun Limau,Religious Sites,NA,3.5,,"Address76 Kim Keat Road Masjid Hajjah Rahimabi Kebun Limau Balestier, Singapore 328835 Singapore",Neighborhood: Novena,1-2 hours,NA
Changi Murals,History Museums,NA,4.0,,NA,Neighborhood: Geylang East,NA,NA
Shaw Tower,Shopping Malls,NA,2.5,,"Address100 Beach Road Shaw Towers, Singapore 189702 Singapore",Neighborhood: Central Area/City Area,NA,NA
Polar Bear Gallery,Art Galleries,NA,5.0,,"Address69A Haji Lane, Singapore 189262 Singapore",Neighborhood: Rochor,1-2 hours,NA
Garden Rhapsody,Cultural Events,NA,4.5,,"Address211 Marina Way Gardens by the Bay, Singapore 018977 Singapore",Neighborhood: Central Area/City Area,< 1 hour,NA
Discover Singapore,Airport Shops,NA,3.0,,NA,Neighborhood: Changi,NA,NA
Star Island,Seasonal Fireworks,NA,3.0,,NA,NA,NA,NA
Lalin Gallery,Points of Interest & Landmarks,NA,5.0,,"Address1 Beach Road #01-24 Raffles Hotel Raffles Hotel Singapore, Singapore 189673 Singapore",Neighborhood: Central Area/City Area,NA,11:00 AM - 8:00 PM
REV Fight Club Gym,Sports Camps & Clinics,NA,5.0,,"Address11D Hongkong Street Level 5, Singapore 059654 Singapore",Neighborhood: Central Area/City Area,NA,NA
Night life in krabi,Points of Interest & Landmarks,NA,4.5,,NA,NA,NA,NA
Church of St Ignatius,Churches & Cathedrals,NA,4.0,,"Address120 King’s Road, Singapore 268172 Singapore",NA,NA,NA
The Gallery of Gnani Arts,Art Galleries,NA,4.0,,"Address19 Tanglin Road #02-41 Tanglin Shopping Centre Golden Wheel Building, Singapore 247909 Singapore",Neighborhood: Central Area/City Area,NA,10:00 AM - 6:00 PM
Mont Blanc,Airport Shops,NA,4.0,,NA,Neighborhood: Changi,NA,NA
Safra Club's Swimming Pool,Sports Complexes,NA,5.0,,"Address1/A Tampines Street 92 Safra Clubhouse (Tampines), Singapore 528882 Singapore",Neighborhood: Tampines,NA,NA
Zhun Ti Gong,Religious Sites,NA,3.0,,"Address13 Keong Saik Road, Singapore 089120 Singapore",Neighborhood: Central Area/City Area,NA,NA
Mohamed Ali Lane,Points of Interest & Landmarks,NA,4.5,,NA,Neighborhood: Outram,NA,12:00 AM - 11:59 PM
Giordano,Airport Shops,NA,3.5,,NA,Neighborhood: Changi,NA,NA
Former House of Tan Yeok Nee,Architectural Buildings,NA,3.0,,"Address101 Penang Road House of Tan Yeok Nee Singapore 238466, Singapore 238466 Singapore",Neighborhood: Museum,< 1 hour,NA
Church of the Nativity of the Blessed Virgin Mary,Churches & Cathedrals,NA,3.5,,"Address1259 Upper Serangoon Road, Singapore 534795 Singapore",Neighborhood: Hougang Central,< 1 hour,NA
Old Admiralty House,Architectural Buildings,NA,3.0,,"Address345 Old Nelson Road Admiralty Hill, Singapore 758692 Singapore",Neighborhood: Sembawang,< 1 hour,8:00 AM - 5:00 PM
iStudio,Airport Shops,NA,3.0,,NA,Neighborhood: Changi,NA,NA
Gajah Gallery,Art Galleries • Art Museums,NA,4.0,,"Address39 Keppel Road Tanjong Pagar Distripark #03-04, Tanjong Pagar Distripar, Singapore 089065 Singapore",Neighborhood: Bukit Merah,< 1 hour,11:00 AM - 7:00 PM
Alexandra Technopark,Points of Interest & Landmarks,NA,5.0,,"Address438A Alexandra Road Alexandra Technopark, Singapore 119967 Singapore",Neighborhood: Pasir Panjang 2,NA,NA
Triple One Somerset,Shopping Malls,NA,3.5,,"Address111 Somerset Road Tripleone Somerset, Singapore 238164 Singapore",Neighborhood: Somerset,NA,NA
Nyee Phoe Flower Garden,Nature & Wildlife Areas,NA,3.5,,"Address240 Neo Tiew Crescent, Singapore 718898 Singapore",Neighborhood: Lim Chu Kang,NA,NA
100 AM,Shopping Malls,NA,3.5,,"Address100 Tras Street 100 AM, Singapore 079027 Singapore",Neighborhood: Anson,2-3 hours,10:00 AM - 10:00 PM
Kult Studio & Gallery,Art Galleries,NA,4.5,,"Address11 Upper Wilkie Road Blk C2-5 Emily Hill, Singapore 228120 Singapore",Neighborhood: Rochor,1-2 hours,11:00 AM - 7:00 PM
Maplewood Park,Parks,NA,3.5,,NA,Neighborhood: Hougang,NA,12:00 AM - 11:59 PM
The Pamela Hat sculpture,Monuments & Statues,NA,3.5,,NA,Neighborhood: Moulmein,< 1 hour,NA
Peranakan Trail,Hiking Trails,NA,3.0,,"Address91 Joo Chiat Road, Singapore 427385 Singapore",Neighborhood: Geylang East,NA,NA
Wat Palelai,Points of Interest & Landmarks • Architectural Buildings • Religious Sites,NA,4.0,,"Address49 Bedok Walk, Singapore 469145 Singapore",Neighborhood: Bedok,1-2 hours,NA
Marina Bay Sands Theatre,Theaters,NA,3.0,,"Address10 Bayfront Avenue Marina Bay Sands The Shoppes at Marina Bay Sands, Singapore 018956 Singapore",Neighborhood: Marina Bay,NA,NA
Stamford House,Architectural Buildings • Shopping Malls,NA,3.5,,NA,NA,NA,NA
Watson's Personal Care Store,Airport Shops,NA,4.0,,NA,Neighborhood: Changi,NA,NA
Church of the Holy Spirit,Churches & Cathedrals,NA,3.5,,"Address248 Upper Thomson Road, Singapore 574371 Singapore",Neighborhood: Bishan,NA,NA
Ubin Thai Buddhist Temple,Points of Interest & Landmarks • Religious Sites,NA,4.0,,"Address70 Sengkang West Avenue #01-03, Singapore 797651 Singapore",Neighborhood: Fernvale,1-2 hours,NA
Bukit Panjang Plaza,Shopping Malls,NA,4.0,,"Address1 Jelebu Road Bukit Panjang Plaza, Singapore 677743 Singapore",Neighborhood: Bukit Panjang,NA,NA
BorderX,Sports Complexes,NA,4.0,,"Address181 Orchard Road #04-22 Orchard Central, Singapore 238896 Singapore",Neighborhood: Somerset,NA,11:00 AM - 9:00 PM
Kiehl's,Airport Shops,NA,5.0,,NA,Neighborhood: Changi,NA,NA
"Statue: A great emporium, Singapore",Points of Interest & Landmarks • Piers & Boardwalks • Monuments & Statues,NA,3.5,,NA,Neighborhood: Sengkang,NA,NA
Lifesystems Chiropractic Pte Ltd,Sports Camps & Clinics,NA,5.0,,"Address237 Alexandra Road The Alexcier #06-13, Singapore 159929 Singapore",Neighborhood: Bukit Merah,NA,NA
Aero-green Technology,Farms,NA,3.5,,"Address260 Neo Tiew Crescent, Singapore 718899 Singapore",Neighborhood: Lim Chu Kang,NA,NA
Singapore Dance Theatre,Theaters,NA,4.5,,"AddressFort Canning Centre 2nd Storey, Cox Terrace, Singapore 179618 Singapore",Neighborhood: Museum,NA,NA
Pandora,NA,NA,NA,,NA,Neighborhood: Changi,NA,NA
Saint George's Church,Architectural Buildings • Churches & Cathedrals,NA,4.0,,"Address44 Minden Road St. George's Church Singapore 248816, Singapore 248816 Singapore",Neighborhood: Tanglin,< 1 hour,NA
Katong Park,Parks,NA,3.0,,"Address59 Fort Road, Singapore 439105 Singapore",Neighborhood: Tanjong Rhu,< 1 hour,NA
Mesjid Temenggong Daeng Ibrahim,Architectural Buildings • Religious Sites,NA,3.5,,NA,Neighborhood: Bukit Merah,NA,NA
Tourist and Transit Hub,Scenic Walking Areas,NA,4.0,,"Address30 Raffles Avenue #01-05 Singapore Flyer, Singapore 039803 Singapore",Neighborhood: Marina Centre,NA,NA
NTU Centre for Contemporary Art,Art Galleries,NA,4.5,,"AddressBlk 43 Malan Road Gillman Barracks, Singapore 109443 Singapore",Neighborhood: Telok Blangah Drive,2-3 hours,12:00 PM - 7:00 PM
Objectifs - Centre for Photography & Film,Art Galleries,NA,4.0,,"Address155 Middle Road, Singapore 188977 Singapore",Neighborhood: Rochor,NA,NA
Masjid Darul Ghufran,Religious Sites,NA,5.0,,"Address503 Tampines Avenue 5 Masjid Darul Gufran, Singapore 529651 Singapore",Neighborhood: Tampines,< 1 hour,NA
Dragonfly Bridge,Bridges,NA,4.0,,NA,Neighborhood: Central Area/City Area,< 1 hour,NA
Olympic Walk,Points of Interest & Landmarks,NA,3.5,,"Address10 Bayfront Avenue Marina Bay Sands, Singapore 018956 Singapore",Neighborhood: Marina Bay,< 1 hour,12:00 AM - 11:59 PM
Naiise Iconic,Shopping Malls,NA,4.5,,"Address78 Airport Blvd #02-205 Jewel, Singapore Changi Airport,, Singapore 819666 Singapore",Neighborhood: Changi,More than 3 hours,10:00 AM - 10:00 PM
Fashion Avenue,Airport Shops,NA,5.0,,NA,Neighborhood: Changi,NA,NA
Fire Flies Health Farm,Farms,NA,3.0,,"Address50 Lim Chu Kang Lane 2 Lot 75, Singapore 718822 Singapore",Neighborhood: Lim Chu Kang,NA,NA
"Statue: From Chettiars to Financiers, Singapore",Points of Interest & Landmarks • Piers & Boardwalks • Monuments & Statues,NA,3.5,,NA,Neighborhood: Bedok South,NA,NA
Journey East,Antique Shops,NA,4.5,,"Address315 Outram Road #03-02 Tan Boon Liat Building, Singapore 169074 Singapore",Neighborhood: Bukit Merah,NA,NA
Hougang Mall,Shopping Malls,NA,3.5,,"Address90 Hougang Avenue 10 Hougang Mall Hougang Mall, Singapore 538766 Singapore",Neighborhood: Hougang Central,1-2 hours,10:00 AM - 10:00 PM
Redsea Gallery,Art Galleries,NA,5.0,,"AddressDempsey Road Block 9, #01-10 Dempsey Hill, Singapore 247697 Singapore",Neighborhood: Tanglin,< 1 hour,NA
