place.name,place.description,place.prices,place.ratings,place.mentions,place.location,place.region,place.spenttime,place.openingtime
Lodare Art,Speciality & Gift Shops,NA,4.0,,"Address756 Upper Serangoon Road Upper Serangoon Shopping Centre Upper Serangoon Shopping Centre Unit 03-12, Singapore 534626 Singapore",Neighborhood: Lorong Ah Soo,NA,12:30 PM - 6:00 PM
Designed Fitness,Health Clubs,NA,4.0,,"Address20 Smith Street Chinatown, Singapore 058934 Singapore",Neighborhood: Outram,NA,NA
Falcon PEV,Gear Rentals,NA,3.0,,"Address2 Alexandra Road Delta House #06-06 Delta House, Singapore 159919 Singapore",Neighborhood: Bukit Merah,2-3 hours,9:30 AM - 7:00 PM
Caffe Ritazza,Bars & Clubs,NA,4.0,,"AddressSingapore Changi Airport Terminal 1, Singapore 819642 Singapore",Neighborhood: Changi,< 1 hour,NA
Lorgan's Kitsch and Flash,Speciality & Gift Shops,NA,4.0,,"Address100E Pasir Panjang Road #01-03 Century Warehouse, Singapore 118521 Singapore",Neighborhood: Pasir Panjang 2,NA,NA
Bistro 1855,Bars & Clubs • Wine Bars,NA,3.0,,"Address3 Temasek Boulevard Suntec City Mall Suntec City, Tower 4 #01-643, Singapore 038983 Singapore",Neighborhood: Marina Centre,1-2 hours,NA
House Of Traditional Javanese Massage,Spas,NA,3.5,,"Address1 Goldhill Plaza Goldhill Plaza Floor 01 Unit 35 37, Singapore 308899 Singapore",Neighborhood: Moulmein,1-2 hours,10:30 AM - 10:30 PM
The Redundant Shop,Speciality & Gift Shops,NA,3.0,,"Address9 Raffles Boulevard Millenia Walk #01-71/72 Millenia Walk, Singapore 039596 Singapore",Neighborhood: Marina Centre,NA,NA
NA,NA,NA,NA,,NA,NA,NA,NA
Spa Nes Pte Ltd,Spas • Thermal Spas,NA,3.5,,"Address407 Havelock Road Level 2, Singapore 169634 Singapore",Neighborhood: Central Area/City Area,2-3 hours,12:00 AM - 11:59 PM
Kyo (Club),Bars & Clubs,NA,3.0,,"Address133 Cecil Street Keck Seng Tower Keck Seng Tower, Singapore 069535 Singapore",Neighborhood: Cecil,More than 3 hours,9:00 PM - 3:00 AM
Raffles Chinese Medicine,Health Clubs,NA,4.0,,"Address585 North Bridge Road Level 13 Raffles Hospital, Singapore 188770 Singapore",Neighborhood: Rochor,NA,NA
Four Season Foot Reflexology Centre,Spas,NA,3.5,,"Address17A Trengganu Street, Singapore 058471 Singapore",Neighborhood: Outram,NA,NA
St James Power Station,Bars & Clubs,NA,3.0,fun,"Address3 Sentosa Gateway, Singapore 098544 Singapore",Neighborhood: Bukit Merah,NA,6:00 PM - 6:00 AM
Hot Spa,Spas,NA,3.5,,"Address50 East Coast Road Roxy Square #03-00 Roxy Square Shopping Centre, Singapore 428769 Singapore",Neighborhood: Marine Parade,2-3 hours,11:00 AM - 11:00 PM
CYC Made To Measure: Best Tailor in Singapore,Speciality & Gift Shops,NA,3.5,,"Address13 Stamford Rd #02-11/12 Capitol Piazza, Singapore 178905 Singapore",Neighborhood: City Hall,1-2 hours,11:00 AM - 8:00 PM
Merlin Goldsmith & Jewellery,Speciality & Gift Shops,NA,3.0,,"Address75 Serangoon Road, Singapore 217980 Singapore",Neighborhood: Little India,< 1 hour,NA
Wang Limo,Taxis & Shuttles,NA,3.0,,"Address61 Kaki Bukit Avenue 1 Shun LI Industrial Park #06-12 Shun Li Industrial Park, Singapore 417943 Singapore",Neighborhood: Bedok,NA,12:00 AM - 11:59 PM
NA,NA,NA,NA,,NA,NA,NA,NA
Timezone Causeway Point,Game & Entertainment Centers,NA,3.0,,"Address1 Woodlands Square #07-02 Causeway Point, Singapore 738099 Singapore",Neighborhood: Woodlands Regional Centre,1-2 hours,NA
Audrey's Wellness,Spas,NA,3.0,,"Address228A Upper Thomson Road Thomson Garden Estate, Singapore 574360 Singapore",Neighborhood: Bishan,1-2 hours,12:00 PM - 8:00 PM
Zin Yee Foot Reflexology Centre,Spas,NA,3.0,,"Address1 Park Road People's Park Complex People's Park Complex, Singapore 059108 Singapore",Neighborhood: Outram,1-2 hours,NA
Blacklane,Taxis & Shuttles,NA,3.0,,NA,NA,NA,NA
Scoop Wholefoods,Speciality & Gift Shops,NA,3.0,,"Address163 Tanglin Road Tanglin Mall Floor 02 Unit 17 18, Singapore 247933 Singapore",Neighborhood: Central Area/City Area,NA,NA
Cheong Kwan Jang,Speciality & Gift Shops,NA,3.0,,"AddressChangi Airport T2, Transit, Singapore 918146 Singapore",Neighborhood: Changi,NA,NA
NA,NA,NA,NA,,NA,NA,NA,NA
Mph,Speciality & Gift Shops,NA,3.0,,"AddressMPH, Velocity at Novena,#02-25-28, 238 Thomson Rd, Singapore 307683 Singapore",Neighborhood: Moulmein,NA,NA
Museum Label,Speciality & Gift Shops,NA,3.0,,"Address93 Stamford Road National Museum of Singapore National Museum of Singapore, Singapore 178897 Singapore",Neighborhood: Museum,NA,NA
Movie Theater,Movie Theaters,NA,3.0,,NA,Neighborhood: Changi,NA,12:00 AM - 11:59 PM
Victoria's Secret,Speciality & Gift Shops,NA,3.0,,NA,Neighborhood: Changi,NA,NA
Tiffany & Co.,Speciality & Gift Shops,NA,3.0,,NA,Neighborhood: Changi,NA,NA
Kerala Ayurveda Centre,Spas,NA,3.0,,"Address43 Chander Road Behind Sri Veeramakaliamman Temple, Singapore 219544 Singapore",Neighborhood: Little India,1-2 hours,NA
The Yoga Co.,Yoga & Pilates,NA,3.0,,"Address2A Haji Lane, Singapore 189195 Singapore",Neighborhood: Rochor,1-2 hours,NA
Statue of Tan Tock Seng,Monuments & Statues,NA,3.0,,"Address1 Parliament Place Parliament House Complex, Singapore 178880 Singapore",Neighborhood: City Hall,< 1 hour,NA
Masjid Omar Kampong Melaka,Points of Interest & Landmarks • Religious Sites,NA,3.0,,"Address10 Keng Cheow Street Masjid Omar Kampong Melaka, Singapore 059607 Singapore",Neighborhood: Central Area/City Area,NA,NA
Statue of Munesh Abdullah,Monuments & Statues,NA,3.0,,"Address1 Old Parliament Lane The Arts House At the Old Parliament, Singapore 179429 Singapore",Neighborhood: City Hall,< 1 hour,NA
Vilebrequin,Speciality & Gift Shops,NA,3.0,,"Address1 Bayfront Avenue Marina Bay Sands Marina Bay Sands Hotel, Singapore 018971 Singapore",Neighborhood: Marina Bay,< 1 hour,NA
Cuppage Plaza,Shopping Malls,NA,3.0,,"Address5 Koek Road Cuppage Plaza, Singapore 228796 Singapore",Neighborhood: Somerset,1-2 hours,NA
Ang Mo Kio Linear Park,Parks,NA,3.0,,NA,Neighborhood: Ang Mo Kio,NA,NA
City Gate Mall,Shopping Malls,NA,3.0,,"Address371 Beach Road City Gate, Singapore 199597 Singapore",NA,NA,NA
Fitness First,Health Clubs,NA,3.0,,"Address20 Pasir Panjang Road #07-29 Mapletree Business City Mapletree Business City,, Singapore 117439 Singapore",Neighborhood: Pasir Panjang 2,NA,NA
Jupiter Road Playground,Parks,NA,3.0,,NA,Neighborhood: Bishan,NA,NA
Luxus Hills Park,Parks,NA,3.0,,NA,Neighborhood: Ang Mo Kio,NA,NA
Butterfly Avenue Playground,Parks,NA,3.0,,NA,Neighborhood: Toa Payoh,NA,NA
Chestnut Close Park,Parks,NA,3.0,,NA,Neighborhood: Bukit Panjang,NA,NA
Kinex Mall @ Katong,Shopping Malls,NA,3.0,,"Address11 Tanjong Katong Road Kinex, Singapore 437157 Singapore",Neighborhood: Geylang East,NA,NA
Tampines Central Park,Biking Trails • Jogging Paths & Tracks,NA,3.0,,NA,Neighborhood: Tampines,NA,NA
Hooper Road Playground,Parks,NA,3.0,,NA,Neighborhood: Moulmein,< 1 hour,NA
Soul Massage,Spas,NA,3.0,,"Address4 Opal Crescent, Singapore 328399 Singapore",Neighborhood: Kallang,1-2 hours,9:00 AM - 10:30 PM
NA,NA,NA,NA,,NA,NA,NA,NA
Yú by Spa Infinity,Spas,NA,3.0,,"Address20 Cecil Street Plus #06-07 Plus, Singapore 049705 Singapore",Neighborhood: Central Area/City Area,1-2 hours,11:00 AM - 9:00 PM
NA,NA,NA,NA,,NA,NA,NA,NA
Spa Lifestyle Beauty & Care,Spas,NA,3.0,,"Address709 East Coast Road Frankel Estate shop houses along Siglap Centre, Singapore 459064 Singapore",Neighborhood: Bedok,More than 3 hours,NA
Taxi2Airport Singapore,Taxis & Shuttles,NA,3.0,,"AddressWeteringschans 28, Singapore 1017 SG Singapore",NA,NA,NA
Shivom Classics,Speciality & Gift Shops,NA,3.0,,"Address304 Orchard Road #01-93 Lucky Plaza, Singapore 238863 Singapore",Neighborhood: Boulevard,< 1 hour,NA
Luxe Limo,Taxis & Shuttles,NA,3.0,,NA,NA,NA,NA
Da Wei Arts n Crafts,Speciality & Gift Shops,NA,3.0,,"Address54 South Bridge Road, Singapore 058685 Singapore",Neighborhood: Central Area/City Area,< 1 hour,NA
Bungy Bar,Bars & Clubs,NA,3.0,,"Address3E River Valley Road #01-07 Clarke Quay, Singapore 179019 Singapore",Neighborhood: Central Area/City Area,1-2 hours,NA
Taboo,Bars & Clubs • Gay Bars,NA,2.5,,"Address65 Neil Rd, Singapore 088897 Singapore",Neighborhood: Outram,< 1 hour,NA
Avalon,Bars & Clubs • Dance Clubs & Discos,NA,3.0,,"Address2 Bayfront Avenue Marina Bay Sands South Crystal Pavilion, Marina Bay Sands, Singapore 018972 Singapore",Neighborhood: Marina Bay,NA,NA
Marina Country Club Singapore,Golf Courses,NA,3.0,,"Address600 Ponggol Seventeenth Av, Singapore 829734 Singapore",Neighborhood: Punggol,NA,NA
Gymkraft,Playgrounds • Game & Entertainment Centers,NA,3.0,,"Address100 Guillemard Road Singapore Badminton Hall, Singapore 399718 Singapore",Neighborhood: Aljunied,NA,NA
alldressedup,Speciality & Gift Shops,NA,2.0,,"Address290 Orchard Road #02-37 the Paragon, Singapore 238859 Singapore",Neighborhood: Boulevard,NA,NA
A&A Wellness Spa,Spas,NA,3.0,,"Address233B Victoria Street, Singapore 188026 Singapore",Neighborhood: Rochor,NA,NA
NA,NA,NA,NA,,NA,NA,NA,NA
Modparade,Speciality & Gift Shops,NA,2.0,,"Address68 Haji Lane, Singapore 189261 Singapore",Neighborhood: Rochor,NA,NA
Mystery Escape,Escape Games,NA,2.5,,"Address283 Jalan Besar, Singapore 208946 Singapore",Neighborhood: Lavender,< 1 hour,NA
Fabrika,Bars & Clubs,NA,3.0,,"Address15 Hoe Chiang Road Tower Fifteen 17/L Klapsons, The Boutique Hotel, Singapore 089316 Singapore",Neighborhood: Anson,NA,NA
NA,NA,NA,NA,,NA,NA,NA,NA
dbl 0,Bars & Clubs,NA,2.5,,"Address222 Queen Street #01-01/02, Singapore 188550 Singapore",Neighborhood: Rochor,NA,NA
OD Wellness,Spas,NA,3.0,masseuse,"Address49 Neil Road, Singapore 088828 Singapore",Neighborhood: Outram,1-2 hours,10:30 AM - 12:30 AM
7D Amazing Xperience,Game & Entertainment Centers,NA,3.0,,"Address3 Temasek Boulevard Suntec City Mall Suntec City Mall East Wing Atrium, Singapore 038983 Singapore",Neighborhood: Central Area/City Area,< 1 hour,NA
NA,NA,NA,NA,,NA,NA,NA,NA
Wild Oats,Bars & Clubs,NA,3.0,,"AddressEmily Hill, 11 Upper Wilkie Road, Singapore 228120 Singapore",Neighborhood: Rochor,NA,NA
NA,NA,NA,NA,,NA,NA,NA,NA
Timezone Waterway Point,Game & Entertainment Centers,NA,2.5,,"Address83 Punggol Central Watertown, Singapore 828761 Singapore",Neighborhood: Punggol Town Centre,< 1 hour,NA
Ancient Dynasty Massage & Spa (Upper Thomson),Spas,NA,3.0,,"AddressNo. 5 Thong Soon Avenue Springleaf Garden Springleaf Garden, Singapore 787433 Singapore",Neighborhood: Yishun,< 1 hour,12:00 AM - 11:59 PM
Tang Dynasty Massage & Spa,Spas,NA,2.0,,"Address2 Chun Tin Road, Singapore 599589 Singapore",Neighborhood: Anak Bukit,NA,NA
Healing Touch Spa,Spas,NA,2.5,,"Address1 Orchid Club Road Orchid Country Club #01-33a, Singapore 769162 Singapore",Neighborhood: Yishun,NA,11:00 AM - 10:30 PM
Spa Symphony,Spas,NA,2.5,,"Address313 Orchard Road 313 @ Somerset 313@Somerset B2-50/51, Singapore 238895 Singapore",Neighborhood: Somerset,1-2 hours,11:00 AM - 9:15 AM
Siam Disco,Bars & Clubs,NA,2.0,,"Address211 Geylang Road, Singapore 389271 Singapore",Neighborhood: Aljunied,NA,NA
Mala Mala,Speciality & Gift Shops,NA,3.0,,"Address290 Orchard Road The Paragon The Paragon, #B1-32, Singapore 238859 Singapore",Neighborhood: Boulevard,< 1 hour,10:00 AM - 9:30 PM
Singapore-Johore Express,Bus Services,NA,3.0,,NA,NA,NA,NA
Teochew Meng Reflexology,Spas,NA,2.0,,"Address1 Park Rd, #04-01 People's Park Complex,, Singapore 059108 Singapore",Neighborhood: Outram,NA,NA
"FIL Skin, Body & Spa Intelligence",Spas,NA,2.0,,"Address68 Orchard Road Plaza Singapura #04-54, Plaza Singapura, Singapore 238839 Singapore",Neighborhood: Museum,NA,NA
Blowfish International Bar,Bars & Clubs,NA,2.5,,"Address360 Orchard Road International Building Next to Thai Embassy, Singapore 238869 Singapore",Neighborhood: Boulevard,NA,6:00 PM - 5:00 AM
Stella Wellness Centre,Spas,NA,2.0,,"AddressNo. 1 Netheravon Road Village Hotel Changi 01-03a, Singapore 508502 Singapore",Neighborhood: Changi,1-2 hours,NA
MOSH!,Game & Entertainment Centers,NA,3.0,,"Address31 Beach View #03-01 Sentosa, Palawan Kidz City, Singapore 098008 Singapore",Neighborhood: Sentosa Island,1-2 hours,10:00 AM - 9:00 PM
Changi Jurassic Mile,Biking Trails • Hiking Trails • Jogging Paths & Tracks,NA,3.0,"east coast park,tanah merah,changi airport,public transport,connector,bike,stroll,exhibits,photos",NA,Neighborhood: Changi,NA,12:00 AM - 11:59 PM
Spa 9,Spas,NA,2.5,,"Address41 Holland Drive #01-01, Singapore 270041 Singapore",Neighborhood: Holland Drive,NA,NA
NA,NA,NA,NA,,NA,NA,NA,NA
NA,NA,NA,NA,,NA,NA,NA,NA
Spa-1 Wellness Centre,Spas,NA,3.0,,"Address511 Guillemard Road Grandlink Square #B1-01 Grandlink Square, Singapore 399849 Singapore",Neighborhood: Aljunied,More than 3 hours,11:00 AM - 11:00 PM
Passage New York,Speciality & Gift Shops,NA,2.5,,"Address133 Cecil Street Floor 01 Keck Seng Tower 01, Singapore 069535 Singapore",Neighborhood: Cecil,NA,11:00 AM - 9:30 PM
Challenge Cube,Escape Games,NA,1.0,,"Address41 West Coast Highway, Singapore 117868 Singapore",Neighborhood: Port,NA,NA
Room 101,Bars & Clubs,NA,1.0,,"Address101 Jalan Sultan The Sultan #01-01, Singapore 199002 Singapore",Neighborhood: Rochor,NA,NA
Shanghai Tang,Speciality & Gift Shops • Shopping Malls,NA,2.5,,"Address391 Orchard Road Ngee Ann City Floor 03 Unit 06 07 Takashimaya Shopping Centre, Singapore 238872 Singapore",Neighborhood: Boulevard,< 1 hour,10:00 AM - 9:30 PM
Spa Esprit,Spas,NA,2.0,,"Address8D Dempsey Road #02-01, Singapore 249672 Singapore",Neighborhood: Tanglin,NA,10:00 AM - 9:00 PM
NA,NA,NA,NA,,NA,NA,NA,NA
NA,NA,NA,NA,,NA,NA,NA,NA
Odyssey Coach,Bus Services,NA,1.0,,"Address400 Balestier Road Balestier Plaza Balestier Plaza, #01-08, Singapore 329802 Singapore",Neighborhood: Novena,NA,NA
White Panda Massage,Spas,NA,3.0,,"Address148 Arab Street, Singapore 199831 Singapore",Neighborhood: Rochor,NA,NA
"Fil Skin, Body & Spa Intelligence",Spas,NA,2.5,,"Address21 Amber Road Chinese Swimming Club, Singapore 439870 Singapore",Neighborhood: Marine Parade,NA,12:00 PM - 9:00 PM
Spa Express,Spas,NA,2.5,,"Address60 Airport Boulevard Changi Airport Terminal 2 Level 3, Unit #036-142, Departure Transit Lounge Terminal 2, Singapore 819643 Singapore",Neighborhood: Changi,NA,NA
NA,NA,NA,NA,,NA,NA,NA,NA
Forest Darts Cafe,Bars & Clubs,NA,3.0,,"Address45 Ann Siang Rd, Singapore 069719 Singapore",Neighborhood: Outram,NA,4:30 PM - 1:00 AM
NA,NA,NA,NA,,NA,NA,NA,NA
WTS Travel,Bus Services,NA,2.5,,"Address31 International Business Park, Singapore 609921 Singapore",Neighborhood: Jurong East,NA,NA
Boulevard,Bars & Clubs,NA,2.5,,"Address9 Raffles Boulevard Millenia Walk, Singapore 039596 Singapore",Neighborhood: Marina Centre,NA,12:00 PM - 12:30 AM
Goodwill Birds Trading,Speciality & Gift Shops,NA,2.5,,"AddressBlk 154 Serangoon North Ave 1#01-428, Singapore 550154 Singapore",Neighborhood: Serangoon,NA,NA
Urban Homme,Spas,NA,1.0,,"Address80 Marine Parade Road Parkway Parade #05-15/16, Singapore 449269 Singapore",Neighborhood: Marine Parade,NA,11:00 AM - 9:00 PM
Kaboom,Speciality & Gift Shops,NA,2.5,,NA,Neighborhood: Changi,NA,NA
Spa Elements,Spas,NA,2.5,,NA,NA,NA,NA
Ng Kim Lee Confectionary,Speciality & Gift Shops,NA,3.0,,"Address4 Chun Tin Road, Singapore 599591 Singapore",Neighborhood: Anak Bukit,< 1 hour,9:00 AM - 9:00 PM
Spacio Beauty,Spas,NA,3.0,"jurong point,facial treatment,nice environment,bugis junction,calla,ipl,beautician,skillful,nex,orchard","AddressBlk 449 Clementi Avenue 3 #01-229, Singapore 120449 Singapore",Neighborhood: Clementi,NA,11:00 AM - 8:00 PM
The Karting Arena,Game & Entertainment Centers,NA,3.0,,"Address200 Turf Club Road The Grandstand #01-01B The Grandstand, South Car Park, Singapore 287994 Singapore",Neighborhood: Swiss Club,< 1 hour,NA
4GLte Unlimited Pocket Wifi in Singapore - pick up at 7Eleven Stores,Gear Rentals,NA,2.0,,"Address10 Anson Road #02-96A International Plaza, Singapore 079903 Singapore",Neighborhood: Central Business District,NA,NA
Feet Haven East Coast,Spas,NA,3.0,,"Address#01-01, 136 East Coast Road, Singapore 428821 Singapore",Neighborhood: Marine Parade,1-2 hours,12:00 PM - 10:00 PM
WE Cinema,Movie Theaters,NA,1.0,,"Address321 Clementi Avenue 3 321 Clementi, Singapore 129905 Singapore",Neighborhood: Clementi,NA,NA
NA,NA,NA,NA,,NA,NA,NA,NA
Donde LimousinE,Taxis & Shuttles,NA,1.0,,"Address8 Kaki Bukit Road 2 #03-05 Ruby Warehouse Complex, Singapore 417841 Singapore",Neighborhood: Bedok,NA,NA
TranSpa,Spas,NA,1.0,,NA,Neighborhood: Changi,NA,NA
"EUROPE SHUTTLE Singapore, Asia",Taxis & Shuttles,NA,1.0,,"AddressMasti Tn 3-9, Singapore 11911 Singapore",Neighborhood: Aljunied,NA,NA
Dream Art,Paint & Pottery Studios,NA,1.0,,"Address321 Alexandra Road Alexandra Central #02-30, Singapore 159971 Singapore",Neighborhood: Bukit Merah,NA,NA
Poolside Bar,Bars & Clubs,NA,1.0,,NA,Neighborhood: Changi,NA,NA
NA,NA,NA,NA,,NA,NA,NA,NA
Book Taxi Singapore,Taxis & Shuttles,NA,2.5,,NA,NA,< 1 hour,NA
Atos Wellness,Spas,NA,1.0,,"Address48 Boon Lay Way The Chevrons #01-06, Singapore 609961 Singapore",Neighborhood: Toh Guan,< 1 hour,NA
NA,NA,NA,NA,,NA,NA,NA,NA
Cash Studio Family Karaoke Box,Karaoke Bars,NA,1.0,,"Address5 Koek Road #2-09 Cuppage Plaza To 20, Singapore 228796 Singapore",Neighborhood: Somerset,NA,NA
Pangaea,Bars & Clubs,NA,2.5,,"Address10 Bayfront Avenue Marina Bay Sands, Singapore 018956 Singapore",Neighborhood: Marina Bay,NA,NA
NA,NA,NA,NA,,NA,NA,NA,NA
Beauty 21 Creative & Beauty Artisan,Spas,NA,1.0,,"Address1 Raffles Link #1-09 One Raffles Link City Link Mall, Singapore 039393 Singapore",Neighborhood: Marina Centre,1-2 hours,11:00 AM - 9:00 PM
Bike stop  @  Fort Road,Gear Rentals,NA,1.0,,"Address720 East Coast Parkway East Coast Park Area B1 – Near To Underpass To Katong Park, Singapore 439174 Singapore",Neighborhood: Marine Parade,1-2 hours,NA
Han Dynasty,Spas,NA,2.0,,"Address123 Bukit Merah Lane 1 #01-98, Singapore 150123 Singapore",Neighborhood: Bukit Merah,NA,NA
Ayurlly Ayurvedic Spa,Spas,NA,1.0,,"Address2 Serangoon Road The Verge # 05 13 11, Singapore 218227 Singapore",Neighborhood: Rochor,NA,NA
Commonwealth Park,Parks,NA,1.0,,NA,Neighborhood: One North,1-2 hours,12:00 AM - 11:59 PM
Cue Guru,Game & Entertainment Centers,NA,2.0,,"Address201 Victoria Street Bugis+ Bugis+, Singapore 188067 Singapore",Neighborhood: Rochor,NA,NA
NA,NA,NA,NA,,NA,NA,NA,NA
NA,NA,NA,NA,,NA,NA,NA,NA
Imbiah Battery,Historic Sites • Historic Walking Areas • Military Bases & Facilities,NA,1.0,,"AddressImbiah Trail, Sentosa Island, Singapore 099700 Singapore",Neighborhood: Tanglin,NA,NA
The Luxe Art Museum,Art Museums,NA,1.0,,"Address6 Handy Road #02-01 the Luxe, Singapore 229234 Singapore",Neighborhood: Central Area/City Area,NA,NA
Eclado Singapore,Spas,NA,1.0,,"Address176 Orchard Road The Centrepoint #02-50/51 The Centrepoint, Singapore 238843 Singapore",Neighborhood: Somerset,NA,NA
Amazonia,Game & Entertainment Centers,NA,2.5,trampoline,"Address1 Kim Seng Promenade Great World City Great World City Mall level 3 Unit #03-113, Singapore 237994 Singapore",Neighborhood: Central Area/City Area,2-3 hours,10:00 AM - 9:00 PM
Le Spa,Spas,NA,2.5,,"Address13 Mohamed Sultan Road, Singapore 238962 Singapore",Neighborhood: Central Area/City Area,NA,NA
NA,NA,NA,NA,,NA,NA,NA,NA
TIFFANY&CO.,Speciality & Gift Shops • Department Stores,NA,1.0,,"Address391 Orchard Road #01- 05/06 & #02-05/06, Singapore 238872 Singapore",Neighborhood: Boulevard,NA,NA
Jean Yip Loft,Spas,NA,1.0,,"Address307 New Bridge Road Jean Yip Loft, Singapore 088757 Singapore",Neighborhood: Central Area/City Area,NA,11:00 AM - 9:00 PM
Ashi Foot Reflexology,Spas,NA,1.0,,"Address914 East Coast Road The Domain #01-05 The Domain, Singapore 459108 Singapore",Neighborhood: Bedok,1-2 hours,NA
Zenith Wholesale Enterprise,NA,NA,2.5,,"Address50 Chin Swee Road Thong Chai Building, Singapore 169874 Singapore",Neighborhood: Central Area/City Area,NA,6:00 AM - 11:30 PM
Kin Teck Tong,Spas,NA,1.0,,"Address1 Stadium Place #02-06 Kallang Wave Mall Sports Hub, Singapore 397628 Singapore",Neighborhood: Tanjong Rhu,NA,NA
Gooday Beautie,Spas,NA,2.5,,"Address101 Serangoon Road, Singapore 218006 Singapore",Neighborhood: Little India,NA,10:30 AM - 9:00 PM
Miss Elegance,Spas,NA,1.0,,"Address1 Tras Link, #02-03/04 Orchid Hotel, Singapore 078867 Singapore",Neighborhood: Central Area/City Area,NA,NA
NA,NA,NA,NA,,NA,NA,NA,NA
Sim Lim Square,Shopping Malls,NA,2.5,,"Address1 Rochor Canal Road Sim Lim Square, Singapore 188504 Singapore",Neighborhood: Rochor,2-3 hours,10:30 AM - 8:00 PM
Slim Couture,Spas,NA,1.0,,"AddressGsh Plaza, 20 Cecil Street, #02-05, Singapore 049705 Singapore",Neighborhood: Central Area/City Area,NA,NA
VR World,Escape Games • Game & Entertainment Centers,NA,1.0,,"Address8A Sago Street Upstairs, Singapore 059012 Singapore",Neighborhood: Outram,1-2 hours,11:00 AM - 11:00 PM
Yeossal,Speciality & Gift Shops,NA,2.5,,"Address33A Circular Road, Singapore 049389 Singapore",Neighborhood: Central Area/City Area,2-3 hours,NA
NA,NA,NA,NA,,NA,NA,NA,NA
Le Spa,Spas,NA,2.0,,"Address14 Gemmill Lane Allan Ville, Singapore 069253 Singapore",Neighborhood: Outram,NA,10:00 AM - 6:00 PM
Diptyque,Speciality & Gift Shops,NA,1.5,,"Address391 Orchard Road Ngee Ann City #B1-33A Takashimaya Shopping Centre, Singapore 238872 Singapore",Neighborhood: Boulevard,< 1 hour,10:00 AM - 9:30 PM
Qi Mantra Remedial Massage,Spas,NA,2.5,,"AddressGreat World City 1 Kim Seng Promenade #03-09/10, Singapore 237994 Singapore",Neighborhood: Central Area/City Area,NA,NA
Estheva Spa,Spas,NA,2.5,facial,"Address328 North Bridge Road Raffles Shopping Arcade # 01 31 30 (You may enter the hotel via level 3 of Marina Square), Singapore 039594 Singapore",Neighborhood: Central Area/City Area,NA,10:00 AM - 10:00 PM
Boons Pottery & Art Gallery,Paint & Pottery Studios,NA,2.0,,"Address91 Tanglin Road Tanglin Place, Singapore 247918 Singapore",Neighborhood: Central Area/City Area,2-3 hours,NA
Michael Trio,NA,NA,NA,,"Address91 Tanjong Pagar Road, Singapore 088512 Singapore",Neighborhood: Outram,NA,NA
Spa De Beaute,Spas,NA,2.0,,"Address324 Tanjong Katong Road, Singapore 437103 Singapore",Neighborhood: Marine Parade,1-2 hours,NA
Seasons Expression Pte Ltd,Spas,NA,2.0,,"Address64A Queen Street Bugis Village, Singapore 188543 Singapore",Neighborhood: Rochor,1-2 hours,NA
Prince and Princess,NA,NA,NA,,"Address50 East Coast Road #02-42 Roxy Square Roxy Square, Singapore 428769 Singapore",Neighborhood: Marine Parade,NA,NA
Airport Wellness Oasis,Spas,NA,2.5,,NA,Neighborhood: Changi,NA,NA
Cecilia Westberry Beauty Spa,Spas,NA,1.0,,"AddressBlk 6 Holland Close #01-20, Singapore 278705 Singapore",Neighborhood: Holland Drive,NA,NA
Aromatherapy Clinic & Spa,NA,NA,NA,,"Address511 Guillemard Road Grandlink Square 01-35 Grandlink Square, Singapore 399849 Singapore",Neighborhood: Aljunied,2-3 hours,NA
Kallang Bowl,Bowling Alleys,NA,2.5,bowling balls,NA,Neighborhood: Tanjong Rhu,NA,NA
NA,NA,NA,NA,,NA,NA,NA,NA
NA,NA,NA,NA,,NA,NA,NA,NA
Sabrinagoh,NA,NA,NA,,"Address13 Stamford Road Capitol Piazza #02-14 Capitol Piazza, Singapore 178905 Singapore",Neighborhood: City Hall,NA,11:00 AM - 9:30 PM
Cathay Cineplexes,Movie Theaters,NA,1.0,,"Address8 Grange Road Cathay Cineleisure  Orchard Levels 4, 5 & 6, Cathay Cineleisure, Singapore 239695 Singapore",Neighborhood: Somerset,NA,NA
True Yoga / Bikram Hot Yoga,Yoga & Pilates,NA,2.5,,"Address9 Scotts Road Pacific Plaza, Singapore 228210 Singapore",Neighborhood: Boulevard,NA,10:30 AM - 10:30 PM
Atlas Transport Services,NA,NA,NA,,NA,NA,NA,NA
Derma Sheer Boutique Beauty Salon,NA,NA,NA,,"Address15 McNair Road Townerville, Singapore 328521 Singapore",Neighborhood: Kallang,1-2 hours,11:00 AM - 8:00 PM
Cow Play Cow Moo,Game & Entertainment Centers,NA,2.0,,"Address3 Temasek Boulevard, Suntec City Tower 3 & 4 #03-372, Singapore 038988 Singapore",NA,NA,NA
Royal Secret Beauty Indulgence ,Spas,NA,1.0,,"Address68 Peck Seah Street Heritage Court, Singapore 79323 Singapore",Neighborhood: Outram,NA,10:30 AM - 8:30 PM
iStudio,Speciality & Gift Shops,NA,2.5,,NA,Neighborhood: Changi,NA,NA
The Polliwogs,NA,NA,NA,,"Address3 Simei Street 6 Eastpoint Mall Eastpoint Mall #04-07, Singapore 528833 Singapore",Neighborhood: Tampines,1-2 hours,10:00 AM - 8:30 PM
KAHF Maxicab Limousine Services,NA,NA,NA,,NA,NA,NA,12:00 AM - 11:59 PM
Batu Pahat Goldsmith Pte Ltd,NA,NA,NA,,"Address2 Buffalo Road, Singapore 219780 Singapore",Neighborhood: Little India,< 1 hour,11:00 AM - 8:00 PM
Newton Show,NA,NA,NA,,"Address2 Pandan Valley #01-206 Acacia Court, Singapore 597626 Singapore",Neighborhood: Ulu Pandan,1-2 hours,9:00 AM - 8:00 PM
Big Box Singapore,Speciality & Gift Shops,NA,2.5,,"Address1 Venture Avenue Big Box Singapore 608521, Singapore 608521 Singapore",Neighborhood: Jurong East,NA,NA
Ton Amusement,Game & Entertainment Centers,NA,2.0,,"Address181 Orchard Road Orchard Central 5F, Unit 43/44, Orchard Central, Singapore 238896 Singapore",Neighborhood: Somerset,NA,NA
Overtime Pub,NA,NA,NA,,"Address30 Mosque Street, Singapore 059508 Singapore",Neighborhood: Outram,More than 3 hours,NA
Platinum Maxicab,NA,NA,NA,,"Address22 Sin Ming Lane #06-76 Midview City, Singapore 573969 Singapore",Neighborhood: Bishan,< 1 hour,12:00 AM - 11:59 PM
Kuko Beauty,NA,NA,NA,,"Address181 Orchard Road Orchard Central #03-12 Orchard Central, Singapore 238896 Singapore",Neighborhood: Somerset,1-2 hours,11:00 AM - 9:00 PM
Toys n Chocolates,NA,NA,NA,,"Address130 Serangoon Road, Singapore 218035 Singapore",Neighborhood: Rochor,More than 3 hours,NA
Ma Kuang Healthcare,Health Clubs,NA,1.5,,"Address141 Middle Road #01-01 Gsm Building, Singapore 188976 Singapore",Neighborhood: Rochor,NA,NA
De Beaute,Spas,NA,2.0,,"Address190 Clemenceau Avenue Singapore Shopping Centre #b1-00/10 & 01-00/10, Singapore 239924 Singapore",Neighborhood: Museum,2-3 hours,NA
Bang Bang,Bars & Clubs,NA,2.5,,"Address7 Raffles Boulevard Pan Pacific Hotel Pan Pacific, Singapore 039595 Singapore",Neighborhood: Marina Centre,NA,12:00 AM - 11:59 PM
NA,NA,NA,NA,,NA,NA,NA,NA
Locomote,NA,NA,NA,,NA,NA,< 1 hour,NA
Essence Vale Spa,Spas,NA,1.0,,"Address75 Airport Boulevard Crowne Plaza Changi Airport Level 3, Singapore 819664 Singapore",Neighborhood: Changi,NA,10:00 AM - 10:00 PM
NA,NA,NA,NA,,NA,NA,NA,NA
